isin,ticker,name,ac,region,sector,ter,size,cur,dist,repl,dom,ytd,y1,y3,vol,div,nh
IE00BJ06C937,JMBA,JPMorgan USD Emerging Markets Sovereign Bond UCITS ETF USD (acc),Bond,Emerging Markets,EM Debt,0.39,87,USD,Accumulating,Sampling,Ireland,5.36,13.44,19.88,5.54,,314
IE00BF2FNH52,TRX3,Invesco US Treasury Bond 1-3 Year UCITS ETF Acc,Bond,North America,Government,0.06,86,USD,Accumulating,Sampling,Ireland,3.84,6.85,,6.09,,95
IE000YSUEJ32,TIGA,L&G India INR Government Bond UCITS ETF USD Acc,Bond,India,Government,0.39,86,USD,Accumulating,Full replication,Ireland,0.22,-3.05,,8.2,,63
LU1452600197,9V60,Amundi US TIPS Government Inflation-Linked Bond UCITS ETF Acc,Bond,North America,Inflation-Linked,0.09,86,USD,Accumulating,Full replication,Luxembourg,4.29,7.1,6.6,6.88,,48
IE00BYTH5602,SPPQ,State Street SPDR Bloomberg U.S. High Yield Corporate Scored UCITS ETF EUR Hedged (Acc),Bond,North America,High Yield,0.35,86,EUR<br />Hedged,Accumulating,Sampling,Ireland,0.87,2.62,21.09,4.72,,573
IE000GHXL2Q3,CEB1,iShares EUR Government Bond 20yr Target Duration UCITS ETF EUR (Acc),Bond,Global / Outros,Government,0.15,85,EUR,Accumulating,Sampling,Ireland,2.21,-3.94,,10.01,,52
IE000IAPH329,AHYT,BNP Paribas Easy II US High Yield Opportunities UCITS ETF USD Acc,Bond,North America,High Yield,0.35,85,USD,Accumulating,Full replication,Ireland,4.84,9.4,,5.59,,313
LU0942970103,XBAG,Xtrackers II ESG Global Aggregate Bond UCITS ETF 1D,Bond,World / Global,Aggregate,0.1,85,USD,Distributing,Sampling,Luxembourg,2.13,3.01,3.59,5.26,2.95,5276
LU1681046345,X13G,Amundi Euro Lowest Rated IG Government Bond 1-3Y UCITS ETF EUR Acc,Bond,Global / Outros,Government,0.14,85,EUR,Accumulating,Full replication,Luxembourg,0.56,1.24,9.34,1.28,,40
IE000U7LIXH5,CLOD,Invesco EUR AAA CLO UCITS ETF Dist,Bond,Global / Outros,Diversified,0.25,83,EUR,Distributing,Full replication,Ireland,1.76,4.25,,0.89,3.81,113
IE000BUIVY49,EUEB,iShares EUR Corporate Bond Enhanced Active UCITS ETF (Acc),Bond,Global / Outros,Corporate,0.2,83,EUR,Accumulating,Full replication,Ireland,1.35,2.54,,2.99,,158
IE00BF8J5974,XYLD,Xtrackers USD Corporate Bond Short Duration SRI PAB UCITS ETF 1D,Bond,Global / Outros,Corporate,0.16,82,USD,Distributing,Sampling,Ireland,4.18,7.62,11.41,6.03,3.64,1386
IE00BMC7BF44,6Q20,iShares China CNY Government Bond UCITS ETF USD (Dist),Bond,China,Government,0.25,82,USD,Distributing,Sampling,Ireland,7.84,9.95,14.32,5.25,1.45,35
IE00BLRPRF81,EMAB,L&G Emerging Markets Corporate Bond (USD) Screened UCITS ETF USD Dist,Bond,Emerging Markets,EM Debt,0.35,82,USD,Distributing,Sampling,Ireland,4.99,9.9,16.12,5.69,5.47,674
IE00BFWFPY67,SPFA,State Street SPDR Bloomberg Emerging Markets Local Bond UCITS ETF USD Unhedged (Acc),Bond,Emerging Markets,EM Debt,0.55,81,USD,Accumulating,Sampling,Ireland,2.31,5.99,11.03,4.8,,595
LU1974693662,UIQG,UBS J.P. Morgan Global Gov ESG Liquid Bond UCITS ETF USD acc,Bond,World / Global,Diversified,0.15,81,USD,Accumulating,Sampling,Luxembourg,1.45,0.6,0.12,42.79,,1354
IE000B1A2798,VGGF,Vanguard Global Government Bond UCITS ETF EUR Hedged Accumulating,Bond,World / Global,Government,0.1,81,EUR<br />Hedged,Accumulating,Sampling,Ireland,-0.2,0,,6.04,,947
LU3254330437,GXUS,Amundi Global ex-US Government Bond UCITS ETF Acc,Bond,World ex-US,Government,0.2,80,USD,Accumulating,Sampling,Luxembourg,,,,,,883
IE00BLRPRD67,USAB,L&G USD Corporate Bond Screened UCITS ETF USD Dist,Bond,Global / Outros,Corporate,0.09,79,USD,Distributing,Sampling,Ireland,4.26,8.17,12.18,6.5,4.56,1774
IE00BMDBMN04,GRON,iShares EUR Green Bond UCITS ETF EUR (Dist),Bond,Global / Outros,Diversified,0.2,78,EUR,Distributing,Sampling,Ireland,1.21,1.4,10.27,4.15,2.89,834
LU1920015440,XUEB,Xtrackers II J.P. Morgan USD Emerging Markets Bond UCITS ETF 2C,Bond,Emerging Markets,EM Debt,0.25,78,USD,Accumulating,Sampling,Luxembourg,6.41,15.06,27.1,5.58,,917
IE0009WMIIC0,H4ZK,HSBC Euro Lower Carbon Government 1-3 Year Bond UCITS ETF,Bond,Global / Outros,Government,0.14,78,EUR,Accumulating,Sampling,Ireland,0.49,1.18,,1.41,,89
IE0006YM7D84,XZHY,Xtrackers USD High Yield Corporate Bond Screened UCITS ETF 1C,Bond,Global / Outros,High Yield,0.25,77,USD,Accumulating,Optimized sampling,Ireland,5.14,9.56,21.66,5.56,,791
LU1407888996,LGQ6,Amundi US Treasury Bond 3-7Y UCITS ETF Dist,Bond,North America,Government,0.06,76,USD,Distributing,Full replication,Luxembourg,2.99,6.27,7.39,6.64,3.24,90
IE00BD4DX952,XQUA,Xtrackers ESG USD Emerging Markets Bond Quality Weighted UCITS ETF 1D,Bond,Emerging Markets,EM Debt,0.45,76,USD,Distributing,Optimized sampling,Ireland,4.23,10.39,10.99,5.85,4.47,382
LU1681046857,X1GD,Amundi Euro Lowest Rated IG Government Bond UCITS ETF EUR Dist,Bond,Global / Outros,Government,0.14,75,EUR,Distributing,Sampling,Luxembourg,1.13,1.45,10.34,4.48,2.55,219
IE00BC7GZJ81,SYBW,State Street SPDR Bloomberg 1-3 Year U.S. Treasury Bond UCITS ETF USD Unhedged (Dist),Bond,North America,Government,0.05,74,USD,Distributing,Sampling,Ireland,3.87,6.85,8.41,6.04,3.82,94
LU0290357507,DBXF,Xtrackers Eurozone Government Bond 15-30 UCITS ETF 1C,Bond,Europe,Government,0.15,74,EUR,Accumulating,Sampling,Luxembourg,1.8,-1.2,1.01,8.76,,56
IE00BCLWRB83,IS3F,iShares USD Corporate Bond Interest Rate Hedged UCITS ETF,Bond,Global / Outros,Corporate,0.25,74,USD,Distributing,Sampling,Ireland,5.72,9.33,18.7,6.01,4.25,2881
IE00BFMKQC67,XDCC,Xtrackers USD Corporate Bond UCITS ETF 1C,Bond,Global / Outros,Corporate,0.12,74,USD,Accumulating,Sampling,Ireland,3.79,7.91,10.59,7.28,,3317
IE000K1VI152,CEMF,iShares USD Treasury Bond 7-10yr UCITS ETF EUR Hedged (Acc),Bond,Global / Outros,Government,0.1,74,EUR<br />Hedged,Accumulating,Sampling,Ireland,-0.78,,,,,14
IE0006QCIHM0,FSCE,Fidelity Global Corp Bond Research Enhanced PAB UCITS ETF ACC-Euro (hedged),Bond,World / Global,Corporate,0.3,73,EUR<br />Hedged,Accumulating,Full replication,Ireland,0.17,2.25,11.07,6.07,,256
LU0468896575,D5BB,Xtrackers II Germany Government Bond UCITS ETF 1D,Bond,Germany,Government,0.15,72,EUR,Distributing,Sampling,Luxembourg,1.02,-0.11,3.69,3.6,1.68,68
LU2970735911,AEHY,Amundi Core EUR High Yield Bond UCITS ETF Acc,Bond,Global / Outros,High Yield,0.15,72,EUR,Accumulating,Sampling,Luxembourg,2.06,,,,,634
IE000SBJO6L2,34GI,iShares iBonds Dec 2034 Term EUR Corporate UCITS ETF EUR (Dist),Bond,Global / Outros,Corporate,0.12,71,EUR,Distributing,Sampling,Ireland,1.74,2.66,,4.83,3.42,144
IE00BP9F2H18,PM9J,PIMCO Advantage US Low Duration Corporate Bond UCITS ETF (Dist),Bond,North America,Corporate,0.25,71,USD,Distributing,Sampling,Ireland,3.72,7.27,12.16,6.19,4.45,323
IE000AALNYM3,FSCI,Fidelity Global Corporate Bond Research Enhanced PAB UCITS ETF EUR Hedged (Dist),Bond,World / Global,Corporate,0.3,71,EUR<br />Hedged,Distributing,Full replication,Ireland,0.12,,,,,256
DE000ETFL532,ELFF,Deka Euro Corporates 0-3 Liquid UCITS ETF ,Bond,Global / Outros,Corporate,0.15,70,EUR,Distributing,Full replication,Germany,0.82,1.74,10.9,0.89,1.48,90
IE000QL3QEM2,H41S,HSBC Global Government Bond UCITS ETF C EUR Hedged,Bond,World / Global,Government,0.1,69,EUR<br />Hedged,Accumulating,Sampling,Ireland,0.1,0.48,,5.67,,1154
LU1829218822,LYBF,Amundi EUR Corporate Bond ex-Financials ESG UCITS ETF Acc,Bond,Global / Outros,Corporate,0.14,68,EUR,Accumulating,Sampling,Luxembourg,1.33,2.06,12.73,2.92,,697
IE000UBGUJP8,UQB1,UniActive Q Corporate Bonds Euro Enhanced UCITS ETF EUR (Dis),Bond,Global / Outros,Corporate,0.2,68,EUR,Distributing,Full replication,Ireland,1.28,,,,,
LU3281688476,CCNG,onemarkets MSCI Euro Government Bond 1M - 1Y UCITS ETF EUR,Bond,Global / Outros,Government,0.2,68,EUR,Accumulating,Optimized sampling,Luxembourg,,,,,,
IE000E0NL9T3,33GI,iShares iBonds Dec 2033 Term EUR Corporate UCITS ETF EUR (Dist),Bond,Global / Outros,Corporate,0.12,67,EUR,Distributing,Sampling,Ireland,1.51,2.44,,4.28,3.41,186
LU2037749152,PR1P,Amundi Core USD Corporate Bond UCITS ETF Dist,Bond,Global / Outros,Corporate,0.07,67,USD,Distributing,Sampling,Luxembourg,3.79,7.89,11.03,7.28,4.57,2881
IE00BD0Q9673,FAHY,Invesco US High Yield Fallen Angels UCITS ETF Dist,Bond,North America,High Yield,0.45,67,USD,Distributing,Full replication,Ireland,4.95,9.97,19.27,5.72,6.43,75
IE000Y247W99,8W00,iShares iBonds Dec 2029 Term USD Corporate UCITS ETF USD (Dist),Bond,Global / Outros,Corporate,0.12,66,USD,Distributing,Sampling,Ireland,4.08,6.96,,6.39,4.47,472
LU1459802754,UIMB,UBS BBG TIPS 10+ UCITS ETF USD dis,Bond,Global / Outros,Inflation-Linked,0.1,66,USD,Distributing,Full replication,Luxembourg,3.04,5.05,-9.16,10.5,6.03,17
IE00B7LGZ558,IS0K,iShares France Government Bond UCITS ETF EUR (Dist),Bond,France,Government,0.2,65,EUR,Distributing,Sampling,Ireland,1.21,0.59,4.64,4.38,2.9,54
IE00BL58LL31,XZBE,Xtrackers USD Corporate Bond SRI PAB UCITS ETF 2C - EUR Hedged,Bond,Global / Outros,Corporate,0.21,65,EUR<br />Hedged,Accumulating,Sampling,Ireland,-0.3,1.97,7.82,7.38,,2009
LU1931975236,PR1G,Amundi Prime Global Government Bond UCITS ETF Dist,Bond,World / Global,Government,0.05,65,EUR,Distributing,Sampling,Luxembourg,1.85,1.6,1.01,3.82,2.91,1064
IE000UY6XF65,IG34,iShares iBonds Dec 2034 Term EUR Corporate UCITS ETF EUR (Acc),Bond,Global / Outros,Corporate,0.12,65,EUR,Accumulating,Sampling,Ireland,1.74,2.53,,4.61,,144
DE000ETFL193,EL4T,Deka Deutsche Boerse EUROGOV Germany 3-5 UCITS ETF,Bond,Germany,Diversified,0.15,64,EUR,Distributing,Full replication,Germany,0.59,0.62,7.46,2.2,1.34,13
LU2182388749,PR1H,Amundi US Treasury Bond 0-1Y UCITS ETF EUR Hedged Acc,Bond,North America,Government,0.07,63,EUR<br />Hedged,Accumulating,Sampling,Luxembourg,0.9,2.1,8.04,4.67,,90
LU1778293313,A4HW,Amundi Core Global Aggregate Bond UCITS ETF USD Hedged Acc,Bond,World / Global,Aggregate,0.1,63,USD<br />Hedged,Accumulating,Sampling,Luxembourg,4.24,5.97,7.62,5.95,,11554
IE000PLCL3C9,CEMD,iShares Global Corporate Bond UCITS ETF EUR Hedged (Acc),Bond,World / Global,Corporate,0.25,62,EUR<br />Hedged,Accumulating,Sampling,Ireland,0.39,2.4,,6.32,,14574
IE00BH3X8336,PM9K,PIMCO Advantage Emerging Markets Local Bond UCITS ETF Dist,Bond,Emerging Markets,EM Debt,0.39,62,USD,Distributing,Sampling,Ireland,5.7,11.19,14.28,5.23,6.53,138
IE000IEOQSJ3,JEYH,JPMorgan EUR High Yield Bond Active UCITS ETF EUR (acc),Bond,Global / Outros,High Yield,0.45,62,EUR,Accumulating,Full replication,Ireland,2.39,4.99,,2.59,,248
IE000YZIVX22,FLCV,Franklin Emerging Markets Sovereign Debt Values UCITS ETF ,Bond,Emerging Markets,EM Debt,0.35,61,USD,Accumulating,Full replication,Ireland,4.12,9.7,15.25,5.47,,65
LU0613540268,XBO2,Xtrackers II Italy Government Bond 0-1 Swap UCITS ETF 1C,Bond,Italy,Government,0.15,60,EUR,Accumulating,Swap based Unfunded,Luxembourg,0.86,1.76,8.74,0.27,,
IE00BGQ0J979,AYE8,iShares J.P. Morgan USD EM Bond UCITS ETF CHF (Acc),Bond,Emerging Markets,EM Debt,0.5,60,CHF<br />Hedged,Accumulating,Sampling,Ireland,1.54,7.1,21.66,7.79,,682
LU1720938841,UEFE,UBS J.P. Morgan EM Multi-Factor Enhanced Local Currency Bond UCITS ETF USD dis,Bond,Emerging Markets,EM Debt,0.4,60,USD,Distributing,Sampling,Luxembourg,5.15,12.56,21.22,5.37,5.35,307
IE0003HV7CS6,I28X,iShares iBonds Dec 2028 Term EUR Corporate Crossover UCITS ETF EUR (Acc),Bond,Global / Outros,Corporate,0.2,59,EUR,Accumulating,Sampling,Ireland,0.99,,,,,250
IE000J6CHW80,EM1A,VanEck US Fallen Angel High Yield Bond UCITS ETF A,Bond,North America,High Yield,0.35,59,USD,Accumulating,Optimized sampling,Ireland,5.63,10.59,,5.64,,130
IE00BZ0G8860,SYBN,State Street SPDR Bloomberg 10+ Year U.S. Corporate Bond UCITS ETF USD,Bond,North America,Corporate,0.12,59,USD,Distributing,Sampling,Ireland,4.29,8.13,7.82,9.6,5.3,1406
IE00BF11F458,SXRR,iShares USD Floating Rate Bond UCITS ETF EUR Hedged,Bond,Global / Outros,Short-Term / MM,0.12,58,EUR<br />Hedged,Distributing,Sampling,Ireland,1.42,3.08,11.46,4.74,4.73,557
IE00BKKCKJ46,JGHY,JPMorgan Global High Yield Corporate Bond Multi-Factor Active UCITS ETF USD (acc),Bond,World / Global,High Yield,0.35,57,USD,Accumulating,Full replication,Ireland,5.52,10.84,23.83,4.84,,312
IE000389GTC0,H41T,HSBC Global Sustainable Government Bond UCITS ETF C EUR Hedged,Bond,World / Global,Government,0.15,57,EUR<br />Hedged,Accumulating,Sampling,Ireland,-0.29,-0.57,,5.5,,784
IE00BF51K132,EMSB,Invesco Emerging Markets USD Bond UCITS ETF Dist,Bond,Emerging Markets,EM Debt,0.25,56,USD,Distributing,Sampling,Ireland,5.31,13.01,24.44,5.74,5.38,372
IE00BKT6BH25,AYEJ,iShares EUR Corporate Bond ex-Financials 1-5yr ESG SRI UCITS ETF EUR (Acc),Bond,Global / Outros,Corporate,0.2,56,EUR,Accumulating,Sampling,Ireland,0.77,1.75,11.97,2,,871
IE000F215NJ2,MG3A,M&G European AAA CLO Active UCITS ETF EUR Acc,Bond,Global / Outros,Diversified,0.25,55,EUR,Accumulating,Full replication,Ireland,,,,,,
IE00BMQ5Y557,TCRS,Janus Henderson HMT Global IG Credit Curve Steepener Core UCITS ETF EUR Acc.,Bond,World / Global,Corporate,0.4,55,EUR,Accumulating,Swap based,Ireland,1.75,2.98,11.85,2.13,,
IE000IZO7033,CBUP,iShares EUR Green Bond UCITS ETF EUR (Acc),Bond,Global / Outros,Diversified,0.2,55,EUR,Accumulating,Sampling,Ireland,1.12,1.4,10.24,3.73,,834
IE0000KA1ZX3,H41Y,HSBC Euro Corporate Bond UCITS ETF Acc,Bond,Global / Outros,Corporate,0.06,55,EUR,Accumulating,Optimized sampling,Ireland,1.36,2.67,,2.99,,1227
IE00BF541080,HY3M,VanEck Emerging Markets High Yield Bond UCITS ETF,Bond,Emerging Markets,High Yield,0.4,54,USD,Accumulating,Sampling,Ireland,6.72,12.13,26.73,5.57,,428
IE000O1FWAW6,IG35,iShares iBonds Dec 2035 Term EUR Corporate UCITS ETF EUR (Acc),Bond,Global / Outros,Corporate,0.12,54,EUR,Accumulating,Sampling,Ireland,2,,,,,92
LU2616774076,BJLJ,BNP Paribas Easy USD Corporate Bond SRI Fossil Free UCITS ETF Acc,Bond,Global / Outros,Corporate,0.2,54,USD,Accumulating,Full replication,Luxembourg,3.73,6.74,,7.14,,476
LU1686830909,LYQS,Amundi USD Emerging Markets Government Bond UCITS ETF Dist,Bond,Emerging Markets,EM Debt,0.25,54,USD,Distributing,Sampling,Luxembourg,5.66,12.91,17.75,5.6,5.07,603
IE000AWT6D61,CEBU,iShares USD Short Duration Corporate Bond UCITS ETF EUR Hedged (Acc),Bond,Global / Outros,Corporate,0.25,54,EUR<br />Hedged,Accumulating,Sampling,Ireland,0.18,1.84,,5.3,,3066
IE000JEXZJT1,FBIE,Fidelity EUR Corporate Bond Research Enhanced UCITS ETF Acc,Bond,Global / Outros,Corporate,0.03,53,EUR,Accumulating,Full replication,Ireland,,,,,,136
LU1435356149,LYX8,Amundi USD High Yield Corporate Bond ESG UCITS ETF Dist,Bond,Global / Outros,High Yield,0.25,53,USD,Distributing,Sampling,Luxembourg,5.06,9.57,21.77,5.58,5.55,823
IE0000BQ75C2,CEMH,iShares USD Short Duration High Yield Corporate Bond UCITS ETF EUR Hedged (Dist),Bond,Global / Outros,High Yield,0.47,53,EUR<br />Hedged,Distributing,Sampling,Ireland,1.2,,,,,1151
LU2468423459,XZEB,Xtrackers II ESG Eurozone Government Bond UCITS ETF 1C,Bond,Europe,Government,0.15,53,EUR,Accumulating,Optimized sampling,Luxembourg,1.15,0.4,5.04,3.94,,328
LU0478205965,XEC1,Xtrackers II EUR Corporate Bond UCITS ETF 1D,Bond,Global / Outros,Corporate,0.09,53,EUR,Distributing,Optimized sampling,Luxembourg,1.39,2.47,15.58,2.9,2.68,4157
IE00BJSBCS90,GASF,Goldman Sachs Access China Government Bond UCITS ETF USD (Dist),Bond,China,Government,0.24,53,USD,Distributing,Sampling,Ireland,6.6,8.15,7.36,5.25,0,47
LU1681046691,DE5A,Amundi Euro Government Bond Highest Rated Investment Grade UCITS ETF EUR Acc,Bond,Global / Outros,Government,0.14,52,EUR,Accumulating,Sampling,Luxembourg,1.18,0.26,4.58,4.11,,197
LU2823895250,EDE0,BNP Paribas Easy Global Aggregate Bond SRI Fossil Free UCITS ETF (Acc),Bond,World / Global,Aggregate,0.08,52,USD,Accumulating,Full replication,Luxembourg,2.83,,,,,580
DE000ETFL359,EL48,Deka iBoxx EUR Liquid Germany Covered Diversified UCITS ETF,Bond,Germany,Covered Bonds,0.09,51,EUR,Distributing,Full replication,Germany,0.96,1.53,10.85,1.94,2.06,30
NL0010273801,VIGB,VanEck iBoxx EUR Sovereign Capped AAA-AA 1-5 UCITS ETF,Bond,Global / Outros,Government,0.15,51,EUR,Distributing,Full replication,Netherlands,0.37,0.74,7.92,2.07,1.05,15
LU1829219713,LYS5,Amundi Euro Highest Rated Macro-Weighted Government Bond 3-5Y UCITS ETF Acc,Bond,Global / Outros,Government,0.17,50,EUR,Accumulating,Full replication,Luxembourg,0.59,0.83,8.16,2.39,,32
IE00BGYWSW13,VCDE,Vanguard USD Corporate 1-3 Year Bond UCITS ETF (EUR) Hedged Accumulating,Bond,Global / Outros,Corporate,0.12,50,EUR<br />Hedged,Accumulating,Sampling,Ireland,0.34,2.07,,5.1,,2056
IE00BF540Z61,GFEA,VanEck Global Fallen Angel High Yield Bond UCITS ETF,Bond,World / Global,High Yield,0.4,50,USD,Accumulating,Sampling,Ireland,6.87,10.3,23.19,4.88,,276
IE000L0X6L81,GSXG,Goldman Sachs Global Green Bond UCITS ETF EUR Hedged (Dist),Bond,World / Global,Diversified,0.22,50,EUR<br />Hedged,Distributing,Full replication,Ireland,-0.94,-2.18,,3.86,0,332
IE0006KNOFD1,FFGE,Fidelity Global HY Corp Bond Research Enhanced PAB UCITS ETF INC-Euro (hedged),Bond,World / Global,High Yield,0.4,49,EUR<br />Hedged,Distributing,Full replication,Ireland,0.98,3.27,16.66,6.42,6.58,280
LU0950676469,CHSV,UBS Core BBG US Treasury 1-10 UCITS ETF USD acc,Bond,North America,Government,0.05,48,USD,Accumulating,Full replication,Luxembourg,3.33,5.85,3.53,6.47,,190
DE000ETFL219,EL4V,Deka Deutsche Boerse EUROGOV Germany 10+ UCITS ETF,Bond,Germany,Diversified,0.15,48,EUR,Distributing,Full replication,Germany,2.14,-2.47,-5.03,7.44,2.16,15
IE000XGNMWE1,HGGA,HSBC Bloomberg Global ESG Aggregate 1-3 Year Bond UCITS ETF USD,Bond,World / Global,Aggregate,0.18,48,USD,Accumulating,Sampling,Ireland,2.63,3.83,6.09,4.45,,358
IE00BF2FNR50,TR7A,Invesco US Treasury Bond 3-7 Year UCITS ETF Acc,Bond,North America,Government,0.06,48,USD,Accumulating,Sampling,Ireland,3.08,6.39,,6.59,,90
IE000QVYFUT7,XIGB,Xtrackers India Government Bond UCITS ETF 1C,Bond,India,Government,0.33,47,USD,Accumulating,Full replication,Ireland,0.44,-2.78,0.32,8.03,,39
IE000H3Q3AF6,VUDS,Vanguard U.S. Treasury 1-3 Year Bond UCITS ETF USD Acc,Bond,North America,Government,0.05,47,USD,Accumulating,Full replication,Ireland,3.84,,,,,92
IE00BDFC6G93,JPBM,JPMorgan USD Emerging Markets Sovereign Bond UCITS ETF USD (dist),Bond,Emerging Markets,EM Debt,0.39,47,USD,Distributing,Sampling,Ireland,5.35,13.45,19.86,5.55,5.67,314
DE000A0D8Q31,EXX6,iShares eb.rexx Government Germany 10.5+yr UCITS ETF (DE),Bond,Germany,Government,0.16,46,EUR,Distributing,Sampling,Germany,1.79,-2.8,-6.04,7.73,2.26,18
LU1215461085,4UBE,UBS BBG MSCI US Liquid Corp Sustainable UCITS ETF USD dis,Bond,North America,Corporate,0.13,46,USD,Distributing,Sampling,Luxembourg,3.55,7.47,9.98,6.8,4.36,488
IE00BM9GRM34,FSCM,Fidelity Global Corp Bond Research Enhanced PAB UCITS ETF INC-USD,Bond,World / Global,Corporate,0.25,46,USD,Distributing,Full replication,Ireland,2.93,6.08,12.76,6.44,4.8,256
IE00BJSBC011,GACN,Goldman Sachs Access China Government Bond UCITS ETF USD (Acc),Bond,China,Government,0.24,46,USD,Accumulating,Sampling,Ireland,7.9,9.94,13.93,5.03,,47
IE000FG3UNB8,ATEA,Invesco EUR AT1 CoCo Bond UCITS ETF Acc,Bond,Global / Outros,Diversified,0.39,45,EUR,Accumulating,Full replication,Ireland,,,,,,96
IE000DOZYQJ7,TAEH,Janus Henderson Haitong Asia ex-Japan High Yield Corp USD Bond Screened Core UCITS ETF EUR-Hedged Dist.,Bond,Japan,High Yield,0.65,45,EUR<br />Hedged,Distributing,Sampling,Ireland,-1.25,0.05,11.52,6.51,3.2,
IE00BN4GXL63,TABC,Janus Henderson EUR IG Bond Paris-aligned Climate Active Core UCITS ETF EUR Acc,Bond,Global / Outros,Diversified,0.19,45,EUR,Accumulating,Full replication,Ireland,1.11,2.04,14.43,2.76,,
LU1910939849,B8TR,Amundi Global Government Inflation-Linked Bond 1-10Y UCITS ETF Dist,Bond,World / Global,Inflation-Linked,0.09,45,USD,Distributing,Sampling,Luxembourg,3.71,5.21,8.64,5.24,1,84
LU3138596492,0G71,Ossiam Euro Government Bonds 7-10Y UCITS ETF (Acc),Bond,Global / Outros,Government,0.17,45,EUR,Accumulating,Full replication,Luxembourg,1.26,,,,,50
IE000R88UVN6,JPUY,JPMorgan USD High Yield Bond Active UCITS ETF USD (dist),Bond,Global / Outros,High Yield,0.45,45,USD,Distributing,Full replication,Ireland,5.32,6.88,,6.43,2.68,475
IE00BF2FNJ76,T3RE,Invesco US Treasury Bond 1-3 Year UCITS ETF EUR Hedged Dist,Bond,North America,Government,0.1,44,EUR<br />Hedged,Distributing,Sampling,Ireland,-0.13,1.25,7,5.16,3.89,95
IE0006MM8VN6,JAGA,JPMorgan Global Aggregate Bond Active UCITS ETF USD (acc),Bond,World / Global,Aggregate,0.31,44,USD,Accumulating,Full replication,Ireland,2.92,4.61,,5.28,,408
IE0006GNB732,XZHE,Xtrackers EUR High Yield Corporate Bond SRI PAB UCITS ETF 1C,Bond,Global / Outros,High Yield,0.25,44,EUR,Accumulating,Optimized sampling,Ireland,1.57,4.37,21.86,2.3,,274
IE00BF8HV717,COVR,PIMCO Covered Bond UCITS ETF Dist,Bond,Global / Outros,Covered Bonds,0.43,44,EUR,Distributing,Sampling,Ireland,-1.81,-1.14,5.39,3.84,0,134
IE00028H9QJ8,XGUE,Xtrackers USD Corporate Green Bond UCITS ETF 1C EUR Hedged,Bond,Global / Outros,Corporate,0.25,44,EUR<br />Hedged,Accumulating,Optimized sampling,Ireland,0.2,2.52,9.77,5.82,,244
LU0641007009,XG7U,Xtrackers II Global Inflation-Linked Bond UCITS ETF 2C - USD Hedged,Bond,World / Global,Inflation-Linked,0.25,43,USD<br />Hedged,Accumulating,Sampling,Luxembourg,4.73,6.88,3.45,6.58,,154
IE0006K7DEL9,GCOR,Franklin Sustainable Euro Green Corporate 1-5 Year UCITS ETF (Acc),Bond,Global / Outros,Corporate,0.18,42,EUR,Accumulating,Full replication,Ireland,0.97,1.99,,1.52,,81
IE00BF2FN752,TRXA,Invesco US Treasury Bond 7-10 Year UCITS ETF Acc,Bond,North America,Government,0.06,42,USD,Accumulating,Sampling,Ireland,2.92,6.7,,7.53,,13
IE00BDD48S37,VGCE,Vanguard EUR Corporate 1-3 Year Bond UCITS ETF EUR Distributing,Bond,Global / Outros,Corporate,0.09,42,EUR,Distributing,Sampling,Ireland,0.71,1.79,,1.63,2.38,842
IE00BZ0XVF52,WTDI,WisdomTree AT1 CoCo Bond UCITS ETF Dist,Bond,Global / Outros,Diversified,0.39,42,USD,Distributing,Sampling,Ireland,4.61,9.77,35.64,4.61,6.77,73
LU1805389258,UIQL,UBS Core BBG Euro Area Liquid Corp UCITS ETF EUR dis,Bond,Global / Outros,Corporate,0.06,41,EUR,Distributing,Sampling,Luxembourg,1.49,2.82,15.88,3.15,3.46,347
LU2470620845,AHYH,Amundi Global Aggregate SRI 1-5 UCITS ETF DR Hedged EUR (C),Bond,World / Global,Aggregate,0.16,41,EUR<br />Hedged,Accumulating,Sampling,Luxembourg,0.15,1.31,8.48,4.97,,2139
LU2823895847,BJLX,BNP Paribas Easy ESG Enhanced EUR Corporate Bond December 2032 UCITS ETF Acc,Bond,Global / Outros,Corporate,0.12,41,EUR,Accumulating,Full replication,Luxembourg,1.51,2.38,,3.73,,149
LU2446383338,ASRX,BNP Paribas Easy EUR Corporate Bond SRI PAB 3-5Y UCITS ETF,Bond,Global / Outros,Corporate,0.15,40,EUR,Accumulating,Full replication,Luxembourg,1.12,2.26,16.06,2.56,,521
IE000O2QIHN4,AGYT,BNP Paribas Easy II Global High Yield Opportunities UCITS ETF USD Acc,Bond,World / Global,High Yield,0.45,40,USD,Accumulating,Full replication,Ireland,4.99,9.38,,5.49,,394
LU2552296563,XY2D,Xtrackers II iBoxx Eurozone Government Bond Yield Plus 1-3 UCITS ETF 2D,Bond,Europe,Government,0.15,39,EUR,Distributing,Sampling,Luxembourg,0.48,1.22,9.79,1.53,1.77,37
LU1737653714,10AL,Amundi Core Euro Government Bond UCITS ETF Dist,Bond,Global / Outros,Government,0.09,39,EUR,Distributing,Sampling,Luxembourg,1.1,0.9,7.94,4.18,2.64,424
LU2099992260,4UBR,UBS BBG MSCI Global Liquid Corp Sustainable UCITS ETF hEUR acc,Bond,World / Global,Corporate,0.16,39,EUR<br />Hedged,Accumulating,Sampling,Luxembourg,0.08,2.19,10.45,6.31,,889
LU3025346910,EDEN,BNP Paribas Easy JPM ESG EMU Government Bond IG 1-10Y UCITS ETF Acc,Bond,Europe,Government,0.08,38,EUR,Accumulating,Full replication,Luxembourg,0.8,,,,,206
LU2785470191,LAAA,Fair Oaks AAA CLO Fund UCITS ETF EUR Dist,Bond,Global / Outros,Diversified,0.35,38,EUR,Distributing,Full replication,Luxembourg,1.62,3.33,,0.61,2.98,
IE000CCQKON9,JHES,Janus Henderson EUR Short Duration Income Active Core UCITS ETF EUR Acc.,Bond,Global / Outros,Diversified,0.25,38,EUR,Accumulating,Full replication,Ireland,0.99,2.3,,0.62,,
NL0009690247,TCBT,VanEck iBoxx EUR Corporates UCITS ETF,Bond,Global / Outros,Corporate,0.15,37,EUR,Distributing,Full replication,Netherlands,1.12,1.89,13.74,3.09,2.65,40
LU2439734141,8OUU,Amundi Global Aggregate SRI UCITS ETF DR (C),Bond,World / Global,Aggregate,0.14,37,USD,Accumulating,Sampling,Luxembourg,1.84,1.98,2.48,5.18,,3328
LU2099295466,B8TD,Amundi Global High Yield Corporate Bond ESG UCITS ETF USD Acc,Bond,World / Global,High Yield,0.25,37,USD,Accumulating,Sampling,Luxembourg,4.03,8.19,21.31,4.78,,999
LU1645386308,SEAD,UBS J.P. Morgan USD EM Diversified Bond 1-5 UCITS ETF hEUR dis,Bond,Emerging Markets,EM Debt,0.38,37,EUR<br />Hedged,Distributing,Sampling,Luxembourg,1.62,5.61,19.94,5.07,6.89,744
IE000N3TZN02,ASHT,BNP Paribas Easy II Short Duration Income Opportunities UCITS ETF USD Acc,Bond,Global / Outros,Diversified,0.19,37,USD,Accumulating,Full replication,Ireland,4.93,,,,,117
LU2742532828,BJLU,BNP Paribas Easy EUR Corporate Bond SRI Fossil Free 7-10Y UCITS ETF Acc,Bond,Global / Outros,Corporate,0.15,37,EUR,Accumulating,Full replication,Luxembourg,1.88,2.65,,4.52,,261
LU2742533636,BJLS,BNP Paribas Easy JPM ESG EMU Government Bond IG 10Y+ UCITS ETF Acc,Bond,Europe,Government,0.15,37,EUR,Accumulating,Full replication,Luxembourg,1.7,-0.39,,8.24,,160
IE00B6QGFW01,IS0S,iShares Emerging Asia Local Government Bond UCITS ETF,Bond,EM Asia,EM Debt,0.5,37,USD,Distributing,Sampling,Ireland,-1.98,-2.71,1.32,5.19,3.53,138
LU1407888053,LYX7,Amundi US Treasury Bond 7-10Y UCITS ETF Dist,Bond,North America,Government,0.06,36,USD,Distributing,Full replication,Luxembourg,2.81,6.5,4.23,7.46,4.09,13
LU1645385839,SEAA,UBS J.P. Morgan USD EM Diversified Bond 1-5 UCITS ETF USD dis,Bond,Emerging Markets,EM Debt,0.35,36,USD,Distributing,Sampling,Luxembourg,5.79,11.53,21.76,5.47,5.63,744
LU1852212965,MDBU,UBS Sustainable Development Bank Bonds UCITS ETF USD dis,Bond,Global / Outros,Diversified,0.15,36,USD,Distributing,Sampling,Luxembourg,3.64,6.68,7.92,6.41,3.06,96
LU1686830065,LCVB,Amundi Euro Corporate 0-1Y ESG UCITS ETF DR (D),Bond,Global / Outros,Corporate,0.08,36,EUR,Distributing,Sampling,Luxembourg,1.04,2.06,9.75,0.18,1.44,289
