isin,ticker,name,ac,region,sector,ter,size,cur,dist,repl,dom,ytd,y1,y3,vol,div,nh
US97717X6519,DGRS,WisdomTree U.S. SmallCap Quality Dividend Growth Fund,Equity,North America,Dividend,0.38,400,USD,,,United States,,,,,,
US97717X6691,DGRW,WisdomTree U.S. Quality Dividend Growth Fund,Equity,North America,Dividend,0.28,16600,USD,,,United States,,,,,,
US97717W2816,DGS,WisdomTree Emerging Markets SmallCap Dividend Fund,Equity,Emerging Markets,Dividend,0.58,1785,USD,,,United States,,,,,,
US78464A7063,DGT,SPDR Global Dow ETF,Equity,World / Global,Developed Markets,0.5,618,USD,,,United States,,,,,,
US97717W2089,DHS,WisdomTree U.S. High Dividend Fund,Equity,North America,Dividend,0.38,1500,USD,,,United States,,,,,,
US19761L5084,DIAL,Columbia Diversified Fixed Income Allocation ETF,Bond,Global / Outros,Corporate Bonds,0.29,393,USD,,,United States,,,,,,
US74347G7051,DIG,ProShares Ultra Oil & Gas,Commodity,Global / Outros,Trading,0.95,64,USD,,,United States,,,,,,
US97717W7781,DIM,WisdomTree International MidCap Dividend Fund,Equity,Global / Outros,Dividend,0.58,162,USD,,,United States,,,,,,
US23908L4059,DINT,Davis Select International ETF,Equity,Global / Outros,Growth,0.66,281,USD,,,United States,,,,,,
US46435U8615,DIVB,iShares U.S. Dividend and Buyback ETF,Equity,North America,Dividend,0.05,1524,USD,,,United States,,,,,,
US0321084099,DIVO,Amplify CWP Enhanced Dividend Income ETF,Equity,Global / Outros,Dividend,0.56,7193,USD,,,United States,,,,,,
US4020318352,DIVS,SmartETFs Dividend Builder ETF,Equity,Global / Outros,Dividend,0.45,38,USD,,,United States,,,,,,
US2103227318,DIVZ,TrueShares Low Volatility Equity Income ETF,Equity,Global / Outros,Broad Market,0.65,267,USD,,,United States,,,,,,
US90269A4500,DJCB,ETRACS Bloomberg Commodity Index Total ReturnSM ETN Series B,Commodity,Global / Outros,Broad Market,0.0,8,USD,,,United States,,,,,,
US46137V6056,DJD,Invesco Dow Jones Industrial Average Dividend ETF,Equity,Global / Outros,Dividend,0.07,464,USD,,,United States,,,,,,
FR0010468983,LYMZ,Lyxor Euro Stoxx 50 Daily (2x) Leveraged UCITS ETF Acc,Equity,Europe,Developed Markets,0.4,218,EUR,,,France,,,,,,
US06738C7781,DJP,iPath Bloomberg Commodity Index Total Return(SM) ETN,Commodity,Global / Outros,Commodities Broad Basket,0.7,850,USD,,,United States,,,,,,
US33740F6988,DJUL,FT Cboe Vest U.S. Equity Deep Buffer ETF - July,Equity,North America,Broad Market,0.85,405,USD,,,United States,,,,,,
US33740F7143,DJUN,FT Cboe Vest U.S. Equity Deep Buffer ETF - June,Equity,North America,Broad Market,0.85,325,USD,,,United States,,,,,,
US97717W3079,DLN,WisdomTree U.S. LargeCap Dividend Fund,Equity,North America,Dividend,0.28,6143,USD,,,United States,,,,,,
US97717W7609,DLS,WisdomTree International SmallCap Dividend Fund,Equity,Global / Outros,Dividend,0.58,1029,USD,,,United States,,,,,,
US33740F7309,DMAY,FT Cboe Vest U.S. Equity Deep Buffer ETF - May,Equity,North America,Broad Market,0.85,370,USD,,,United States,,,,,,
US00774Q1489,DMCY,Democracy International Fund,Equity,Global / Outros,Broad Market,0.5,11,USD,,,United States,,,,,,
US26922A3471,DMDV,AAM S&P Developed Markets High Dividend Value ETF,Equity,Global / Outros,Dividend,0.39,2,USD,,,United States,,,,,,
US46436E7590,DMXF,iShares ESG Advanced MSCI EAFE Index ETF,Equity,Global / Outros,Developed Markets,0.12,1217,USD,,,United States,,,,,,
US97717W8441,DNL,WisdomTree Global ex-U.S. Quality Dividend Growth Fund,Equity,North America,Dividend,0.42,487,USD,,,United States,,,,,,
US33740F8398,DNOV,FT Cboe Vest U.S. Equity Deep Buffer ETF - November,Equity,North America,Broad Market,0.85,393,USD,,,United States,,,,,,
LU1437016543,DNRA,Amundi Index Solutions - Amundi Index MSCI North America UCITS ETF DR EUR,Equity,Global / Outros,Developed Markets,,,EUR,,,Luxembourg,,,,,,
US33740F6723,DOCT,FT Cboe Vest U.S. Equity Deep Buffer ETF - October,Equity,North America,Broad Market,0.85,390,USD,,,United States,,,,,,
US74347B2354,DOG,ProShares Short Dow30,Equity,Global / Outros,Large Cap,0.95,111,USD,,,United States,,,,,,
US97717W7948,DOL,WisdomTree International LargeCap Dividend Fund,Equity,Global / Outros,Dividend,0.48,815,USD,,,United States,,,,,,
US97717W5058,DON,WisdomTree U.S. MidCap Dividend Fund,Equity,North America,Dividend,0.38,3963,USD,,,United States,,,,,,
US25460G1537,DPST,Direxion Daily Regional Banks Bull 3X Shares,Equity,Global / Outros,Financials,0.92,448,USD,,,United States,,,,,,
US25460G3285,DRIP,Direxion Daily S&P Oil & Gas Exp. & Prod. Bear 2X Shares,Commodity,Global / Outros,Trading,1.01,131,USD,,,United States,,,,,,
US37954Y6243,DRIV,Global X Autonomous & Electric Vehicles ETF,Equity,World / Global,Developed Markets,0.68,441,USD,,,United States,,,,,,
US25459W7552,DRN,Direxion Daily MSCI Real Estate Bull 3X Shares,Real Estate,Global / Outros,Real Estate,0.98,46,USD,,,United States,,,,,,
US26922A3885,DRSK,Aptus Defined Risk ETF,Equity,Global / Outros,Broad Market,0.78,1506,USD,,,United States,,,,,,
US25460G4192,DRV,Direxion Daily MSCI Real Estate Bear 3X Shares,Real Estate,Global / Outros,Real Estate,1.06,29,USD,,,United States,,,,,,
US33740F6806,DSEP,FT Cboe Vest U.S. Equity Deep Buffer ETF - September,Equity,North America,Broad Market,0.85,348,USD,,,United States,,,,,,
US4642885705,DSI,iShares MSCI KLD 400 Social ETF,Equity,Global / Outros,Factors,0.25,5361,USD,,,United States,,,,,,
US22542D6546,DSLVF,VelocityShares 3x Inverse Silver ETN Linked to the S&P GSCI Silver Index ER,Commodity,Global / Outros,Precious Metals,1.65,1,USD,,,United States,,,,,,
US26922A3216,DSTL,Distillate U.S. Fundamental Stability & Value ETF,Equity,North America,Factors,0.39,2123,USD,,,United States,,,,,,
US26922B5012,DSTX,Distillate International Fundamental Stability & Value ETF,Equity,Global / Outros,Broad Market,0.55,47,USD,,,United States,,,,,,
FR0011607084,DSUS,Lyxor 10Y US Treasury Daily (-2x) Inverse UCITS ETF Acc,Bond,North America,Treasury Bonds,0.2,23,USD,,,France,,,,,,
US97717W1099,DTD,WisdomTree U.S. Total Dividend Fund,Equity,North America,Dividend,0.28,1613,USD,,,United States,,,,,,
US00162Q4780,DTEC,ALPS Disruptive Technologies ETF,Equity,Global / Outros,Technology,0.5,70,USD,,,United States,,,,,,
US97717W8029,DTH,WisdomTree International High Dividend Fund,Equity,Global / Outros,Dividend,0.58,624,USD,,,United States,,,,,,
US74347G1765,DUG,ProShares UltraShort Oil & Gas,Commodity,Global / Outros,Trading,0.95,27,USD,,,United States,,,,,,
US66538J2906,DUKH,Duke Energy Corporation JR SUB DEB 73,Bond,Global / Outros,Energy,1.07,22,USD,,,United States,,,,,,
US92189H1023,DURA,VanEck Vectors Morningstar Durable Dividend ETF,Equity,Global / Outros,Dividend,0.3,37,USD,,,United States,,,,,,
US23908L2079,DUSA,Davis Select U.S. Equity ETF,Equity,North America,Factors,0.59,1221,USD,,,United States,,,,,,
US25460E7379,DUSL,Direxion Daily Industrials Bull 3X Shares Direxion Daily Industrials Bull 3,Equity,Global / Outros,Trading,0.97,63,USD,,,United States,,,,,,
US25461A1896,DUST,Direxion Daily Gold Miners Index Bear 2X Shares,Commodity,Global / Outros,Precious Metals,0.94,84,USD,,,United States,,,,,,
US33741L2079,DVLU,First Trust Dorsey Wright Momentum & Value ETF,Equity,Global / Outros,Broad Market,0.6,46,USD,,,United States,,,,,,
US33741L1089,DVOL,First Trust Dorsey Wright Momentum & Low Volatility ETF,Equity,Global / Outros,Factors,0.6,71,USD,,,United States,,,,,,
US4642871689,DVY,iShares Select Dividend ETF,Equity,Global / Outros,Dividend,0.38,22901,USD,,,United States,,,,,,
US4642862936,DVYA,iShares Asia/Pacific Dividend ETF,Equity,Asia,Dividend,0.49,66,USD,,,United States,,,,,,
US4642863199,DVYE,iShares Emerging Markets Dividend ETF,Equity,Emerging Markets,Dividend,0.5,1175,USD,,,United States,,,,,,
US46138E8425,DWAS,Invesco DWA SmallCap Momentum ETF,Equity,Global / Outros,Small Cap,0.6,455,USD,,,United States,,,,,,
US00768Y4796,DWAW,AdvisorShares Dorsey Wright FSM All Cap World ETF,Equity,World / Global,Broad Market,1.23,94,USD,,,United States,,,,,,
US23908L3069,DWLD,Davis Select Worldwide ETF,Equity,World / Global,Developed Markets,0.62,568,USD,,,United States,,,,,,
US97717W7039,DWM,WisdomTree International Equity Fund,Equity,Global / Outros,Developed Markets,0.48,663,USD,,,United States,,,,,,
US97717Y7748,DWMF,WisdomTree International Multifactor Fund,Equity,Global / Outros,Developed Markets,0.4,34,USD,,,United States,,,,,,
US00768Y5298,DWSH,AdvisorShares Dorsey Wright Short ETF,Equity,Global / Outros,Equities,6.22,11,USD,,,United States,,,,,,
US00768Y4879,DWUS,AdvisorShares Dorsey Wright FSM US Core ETF,Equity,North America,Blend,1.08,130,USD,,,United States,,,,,,
US78463X7729,DWX,SPDR S&P International Dividend ETF,Equity,Global / Outros,Dividend,0.45,504,USD,,,United States,,,,,,
LU0328473581,DX2K,Xtrackers FTSE 100 Short Daily Swap UCITS ETF 1C,Equity,United Kingdom,Developed Markets,0.5,16,EUR,,,Luxembourg,,,,,,
US74347G3746,DXD,ProShares UltraShort Dow30,Equity,Global / Outros,Large Cap,0.95,46,USD,,,United States,,,,,,
US97717W8516,DXJ,WisdomTree Japan Hedged Equity Fund,Equity,Japan,Developed Markets,0.48,7080,USD,,,United States,,,,,,
LU0322251520,DXS3,Xtrackers S&P 500 Inverse Daily Swap UCITS ETF 1C,Equity,North America,Large Cap,0.5,178,EUR,,,Luxembourg,,,,,,
LU0292101796,DXSD,Xtrackers Stoxx Europe 600 Oil & Gas Swap UCITS ETF 1C,Commodity,Europe,Developed Markets,,,EUR,,,Luxembourg,,,,,,
LU0292106753,DXSP,Xtrackers Euro Stoxx 50 Short Daily Swap UCITS ETF 1C,Equity,Europe,Derivatives,0.4,29,EUR,,,Luxembourg,,,,,,
LU0290358653,DXSQ,Xtrackers II iTraxx Europe Swap UCITS ETF 1C,Bond,Europe,Corporate Bonds,0.18,8,EUR,,,Luxembourg,,,,,,
LU0321462870,DXST,Xtrackers II iTraxx Crossover Short Daily Swap UCITS ETF 1C,Equity,Global / Outros,Corporate Bonds,0.24,73,EUR,,,Luxembourg,,,,,,
LU0321463258,DXSV,Xtrackers II Eurozone Government Bond Short Daily Swap UCITS ETF 1C,Bond,Europe,Government Bonds,0.15,73,EUR,,,Luxembourg,,,,,,
LU0321463506,DXSW,Xtrackers II iBoxx Germany Covered Bond Swap UCITS ETF 1C,Bond,Global / Outros,Corporate Bonds,0.15,37,EUR,,,Luxembourg,,,,,,
US09290C1036,DYNF,BlackRock U.S. Equity Factor Rotation ETF,Equity,North America,Large Cap,0.26,38004,USD,,,United States,,,,,,
LU1104582231,E044,ComStage ShortMDAX UCITS ETF,Equity,Global / Outros,Broad Market,,,EUR,,,Luxembourg,,,,,,
LU0635178014,E127,ComStage - MSCI Emerging Markets UCITS ETF,Equity,Emerging Markets,Emerging Markets,0.14,11752,GBP,,,Luxembourg,,,,,,
DE000ETF9017,E901,Lyxor 1 DAX UCITS ETF (I),Equity,Global / Outros,Developed Markets,,,EUR,,,Germany,,,,,,
LU2198884491,EABE,Lyxor Net Zero 2050 S&P Europe Climate PAB (DR) UCITS ETF - Acc,Equity,Europe,Developed Markets,0.15,,EUR,,,Luxembourg,,,,,,
JE00B6VG2P72,EALU,WisdomTree Aluminium - EUR Daily Hedged,Commodity,Global / Outros,Broad Market,,16,EUR,,,Jersey,,,,,,
US46436E6683,EAOA,iShares ESG Aware Aggressive Allocation ETF,Equity,Global / Outros,Broad Market,0.18,37,USD,,,United States,,,,,,
US46436E6923,EAOK,iShares ESG Aware Conservative Allocation ETF,Equity,Global / Outros,Broad Market,0.18,9,USD,,,United States,,,,,,
US46436E6840,EAOM,iShares ESG Aware Moderate Allocation ETF,Equity,Global / Outros,Broad Market,0.18,9,USD,,,United States,,,,,,
US46436E6766,EAOR,iShares ESG Aware Growth Allocation ETF,Equity,Global / Outros,Broad Market,0.18,33,USD,,,United States,,,,,,
US45782C3593,EAPR,Innovator MSCI Emerging Markets Power Buffer ETF - April,Equity,Emerging Markets,Emerging Markets,0.89,105,USD,,,United States,,,,,,
US2330512185,EASG,Xtrackers MSCI EAFE ESG Leaders Equity ETF,Equity,Global / Outros,Factors,0.14,67,USD,,,United States,,,,,,
US00768Y3889,EATZ,AdvisorShares Restaurant ETF,Equity,Global / Outros,Consumer Discretionary,1.0,2,USD,,,United States,,,,,,
US37954Y4677,EBIZ,Global X E-commerce ETF,Equity,World / Global,Broad Market,0.5,26,USD,,,United States,,,,,,
US78464A3914,EBND,SPDR Bloomberg Barclays Emerging Markets Local Bond ETF,Bond,Emerging Markets,Government Bonds,0.3,2260,USD,,,United States,,,,,,
JE00B766LB87,PBRT,WisdomTree Brent Crude Oil - GBP Daily Hedged,Commodity,Global / Outros,Broad Market,,,GBP,,,Jersey,,,,,,
LU1199448058,ECBD,UC Thomson Reuters Balanced European Convertible Bond UCITS ETF,Bond,Europe,Corporate Bonds,,,EUR,,,Luxembourg,,,,,,
US4642866408,ECH,iShares MSCI Chile ETF,Equity,Global / Outros,Emerging Markets,0.59,1033,USD,,,United States,,,,,,
JE00B3VJDN05,EUP3,WisdomTree Long EUR Short GBP 3x Daily,Equity,Global / Outros,Broad Market,,0,GBP,,,Jersey,,,,,,
US46429B2007,ECNS,iShares MSCI China Small-Cap ETF,Equity,China,Small Cap,0.59,64,USD,,,United States,,,,,,
LU0721553864,UEFR,UBS ETF - Bloomberg Barclays Euro Area Liquid Corporates UCITS ETF (EUR) A-dis,Bond,Global / Outros,Corporate Bonds,,,EUR,,,Luxembourg,,,,,,
JE00B6TK3K31,ECOF,WisdomTree Coffee - EUR Daily Hedged,Commodity,Global / Outros,Broad Market,,2,EUR,,,Jersey,,,,,,
US19762B5093,ECON,Columbia Emerging Markets Consumer ETF,Equity,Emerging Markets,Consumer,0.47,349,USD,,,United States,,,,,,
US69374H8658,ECOW,Pacer Emerging Markets Cash Cows 100 ETF,Equity,Emerging Markets,Emerging Markets,0.7,210,USD,,,United States,,,,,,
JE00B6RV6N28,PCRD,WisdomTree WTI Crude Oil - GBP Daily Hedged,Commodity,Global / Outros,Broad Market,,,GBP,,,Jersey,,,,,,
JE00B3ZQRP79,ECRN,WisdomTree Corn - EUR Daily Hedged,Commodity,Global / Outros,Broad Market,,1,EUR,,,Jersey,,,,,,
JE00B70DCH80,ECTN,WisdomTree Cotton - EUR Daily Hedged,Commodity,Global / Outros,Broad Market,,1,EUR,,,Jersey,,,,,,
US25490K2814,EDC,Direxion Daily MSCI Emerging Markets Bull 3X Shares,Equity,Emerging Markets,Emerging Markets,1.09,185,USD,,,United States,,,,,,
US46429B5232,EDEN,iShares MSCI Denmark ETF,Equity,Global / Outros,Developed Markets,0.53,188,USD,,,United States,,,,,,
US78463X5335,EDIV,SPDR S&P Emerging Markets Dividend ETF,Equity,Emerging Markets,Dividend,,,USD,,,United States,,,,,,
IE00BF2PG656,EDMF,iShares Edge MSCI EMU Multifactor UCITS ETF EUR (Acc),Equity,Europe,Developed Markets,,,EUR,,,Ireland,,,,,,
US00162Q6686,EDOG,ALPS Emerging Sector Dividend Dogs ETF,Equity,Emerging Markets,Dividend,0.6,28,USD,,,United States,,,,,,
US33733A2015,EDOW,First Trust Dow 30 Equal Weight ETF,Equity,Global / Outros,Large Cap,0.5,307,USD,,,United States,,,,,,
US9219107094,EDV,Vanguard Extended Duration Treasury Index Fund ETF Shares,Bond,Global / Outros,Treasury Bonds,0.05,4162,USD,,,United States,,,,,,
US25461H8613,EDZ,Direxion Daily MSCI Emerging Markets Bear 3X Shares,Equity,Emerging Markets,Emerging Markets,1.05,14,USD,,,United States,,,,,,
IE00BHZPJ122,EGDM,iShares MSCI EM ESG Enhanced UCITS ETF USD Inc,Equity,Global / Outros,Emerging Markets,0.18,10680,GBP,,,Ireland,,,,,,
LU1859445063,ZSRL,BNP Paribas Easy FTSE EPRA/NAREIT Developed Europe UCITS ETF QD H EUR,Real Estate,Europe,Real Estate,,,EUR,,,Luxembourg,,,,,,
US46138E2972,EELV,Invesco S&P Emerging Markets Low Volatility ETF,Equity,Emerging Markets,Emerging Markets,0.29,423,USD,,,United States,,,,,,
US4642864262,EEMA,iShares MSCI Emerging Markets Asia ETF,Equity,Emerging Markets,Emerging Markets,0.49,905,USD,,,United States,,,,,,
US26922A5864,EEMD,AAM S&P Emerging Markets High Dividend Value ETF,Equity,Emerging Markets,Dividend,0.49,9,USD,,,United States,,,,,,
US46138E2899,EEMO,Invesco S&P Emerging Markets Momentum ETF,Equity,Emerging Markets,Emerging Markets,0.29,24,USD,,,United States,,,,,,
US4642864759,EEMS,iShares MSCI Emerging Markets Small-Cap ETF,Equity,Emerging Markets,Emerging Markets,0.72,380,USD,,,United States,,,,,,
US4642865335,EEMV,iShares MSCI Emerging Markets Min Vol Factor ETF,Equity,Emerging Markets,Emerging Markets,0.25,3654,USD,,,United States,,,,,,
US78470E2054,EEMX,SPDR MSCI Emerging Markets Fossil Fuel Free ETF,Equity,Emerging Markets,Emerging Markets,0.3,181,USD,,,United States,,,,,,
LU1291109293,XU61,BNP Paribas Easy ECPI Global ESG Infrastructure UCITS ETF Capitalisation,Equity,World / Global,Broad Market,,,EUR,,,Luxembourg,,,,,,
LU1291091228,EEP,BNP Paribas Easy FTSE EPRA/NAREIT Developed Europe UCITS ETF QD EUR,Real Estate,Europe,Real Estate,,27,EUR,,,Luxembourg,,,,,,
US97717W5629,EES,WisdomTree U.S. SmallCap Earnings Fund,Equity,North America,Small Cap,0.38,724,USD,,,United States,,,,,,
LU1792117340,LESE,Lyxor MSCI EMU ESG Trend Leaders (DR) UCITS ETF - Acc,Equity,Europe,Developed Markets,,,EUR,,,Luxembourg,,,,,,
US74347X3026,EET,ProShares Ultra MSCI Emerging Markets,Equity,Emerging Markets,Emerging Markets,0.95,53,USD,,,United States,,,,,,
US74350P6346,EEV,ProShares UltraShort MSCI Emerging Markets,Equity,Emerging Markets,Emerging Markets,0.95,3,USD,,,United States,,,,,,
LU1291100664,EEXU,BNP Paribas Easy MSCI Europe ex UK ex CW UCITS ETF Cap,Equity,Europe,Developed Markets,,,EUR,,,Luxembourg,,,,,,
US4642874659,EFA,iShares MSCI EAFE ETF,Equity,Global / Outros,Developed Markets,0.32,77218,USD,,,United States,,,,,,
US74347B8393,EFAD,ProShares MSCI EAFE Dividend Growers ETF,Equity,Global / Outros,Dividend,0.5,61,USD,,,United States,,,,,,
US37954Y6995,EFAS,Global X MSCI SuperDividend EAFE ETF,Equity,World / Global,Dividend,0.55,48,USD,,,United States,,,,,,
US46429B6891,EFAV,iShares MSCI EAFE Min Vol Factor ETF,Equity,Global / Outros,Developed Markets,0.2,5082,USD,,,United States,,,,,,
US78470E1064,EFAX,SPDR MSCI EAFE Fossil Fuel Free ETF,Equity,Global / Outros,Developed Markets,0.2,503,USD,,,United States,,,,,,
JE00B460QR00,EFCM,WisdomTree Broad Commodities Longer Dated - EUR Daily Hedged,Commodity,Global / Outros,Broad Market,,3,EUR,,,Jersey,,,,,,
IE00BD5KGK77,FEEM,Invesco Goldman Sachs Equity Factor Index Emerging Markets UCITS ETF A USD Acc,Commodity,Emerging Markets,Precious Metals,,,EUR,,,Ireland,,,,,,
US4642888857,EFG,iShares MSCI EAFE Growth ETF,Equity,Global / Outros,Developed Markets,0.34,16891,USD,,,United States,,,,,,
IE00BMW3NY56,SMLU,Invesco Goldman Sachs Equity Factor Index Europe UCITS ETF,Commodity,Europe,Precious Metals,0.45,11,EUR,,,Ireland,,,,,,
IE00BFG1RG61,SMLW,Invesco Goldman Sachs Equity Factor Index World UCITS ETF,Commodity,World / Global,Precious Metals,0.55,27,EUR,,,Ireland,,,,,,
US78468R5312,EFIV,SPDR S&P 500 ESG ETF,Equity,North America,Large Cap,0.1,1094,USD,,,United States,,,,,,
US46429B5158,EFNL,iShares MSCI Finland ETF,Equity,Global / Outros,Developed Markets,0.53,208,USD,,,United States,,,,,,
IE00BDRTCP90,EFNT,Invesco Euro Floating Rate Note UCITS ETF Dist,Bond,Global / Outros,Corporate Bonds,,,EUR,,,Ireland,,,,,,
US74347X5005,EFO,ProShares Ultra MSCI EAFE,Equity,Global / Outros,Developed Markets,0.95,29,USD,,,United States,,,,,,
US74349Y7388,EFU,ProShares UltraShort MSCI EAFE,Equity,Global / Outros,Developed Markets,0.95,1,USD,,,United States,,,,,,
US4642888774,EFV,iShares MSCI EAFE Value ETF,Equity,Global / Outros,Value,0.31,23718,USD,,,United States,,,,,,
US74347R3701,EFZ,ProShares Short MSCI EAFE,Equity,Global / Outros,Developed Markets,0.95,12,USD,,,United States,,,,,,
JE00BMM1XC77,EUP5,WisdomTree Long EUR Short GBP 5x Daily,Equity,Global / Outros,Broad Market,,1,GBP,,,Jersey,,,,,,
US46429B3096,EIDO,iShares MSCI Indonesia ETF,Equity,Global / Outros,Emerging Markets,0.59,401,USD,,,United States,,,,,,
JE00B63MJ075,PIMT,WisdomTree Industrial Metals - GBP Daily Hedged,Commodity,Global / Outros,Broad Market,,,GBP,,,Jersey,,,,,,
US92189H8705,EINC,VanEck Vectors Energy Income ETF,Equity,Global / Outros,Energy,0.46,109,USD,,,United States,,,,,,
US46429B5075,EIRL,iShares MSCI Ireland ETF,Equity,Global / Outros,Developed Markets,0.5,74,USD,,,United States,,,,,,
US4642866325,EIS,iShares MSCI Israel ETF,Equity,Global / Outros,Developed Markets,0.59,898,USD,,,United States,,,,,,
US45782C5168,EJAN,Innovator MSCI Emerging Markets Power Buffer ETF January,Equity,Emerging Markets,Emerging Markets,0.89,156,USD,,,United States,,,,,,
US45782C7149,EJUL,Innovator MSCI Emerging Markets Power Buffer ETF - July,Equity,Emerging Markets,Emerging Markets,0.89,136,USD,,,United States,,,,,,
DE000ETFL086,EL4H,Deka MSCI Europe LC UCITS ETF,Bond,Europe,Large Cap,,11,EUR,,,Germany,,,,,,
DE000ETFL102,EL4J,Deka MSCI Japan LC UCITS ETF,Bond,Japan,Large Cap,,639,EUR,,,Germany,,,,,,
US97717X8671,ELD,WisdomTree Emerging Markets Local Debt Fund,Bond,Emerging Markets,Emerging Markets,0.55,142,USD,,,United States,,,,,,
DE000ETFL458,ELF5,Deka MSCI Europe ex EMU UCITS ETF,Equity,Europe,Developed Markets,,3,EUR,,,Germany,,,,,,
DE000ETFL516,ELFG,Deka Germany 30 UCITS ETF,Equity,Global / Outros,Developed Markets,,3,EUR,,,Germany,,,,,,
LU1481202775,ELQC,BNP Paribas Easy Markit iBoxx EUR Liquid Corporates UCITS ETF Cap,Bond,Global / Outros,Corporate Bonds,,,EUR,,,Luxembourg,,,,,,
US4642882819,EMB,iShares J.P. Morgan USD Emerging Markets Bond ETF,Bond,Emerging Markets,Government Bonds,0.39,14615,USD,,,United States,,,,,,
US37954Y3505,EMBD,Global X Emerging Markets Bond ETF,Bond,Emerging Markets,Government Bonds,0.39,252,USD,,,United States,,,,,,
LU1686831030,EMBH,Lyxor Index Fund - Lyxor iBoxx $ Liquid Emerging Markets Sovereign UCITS ETF Monthly Hdg to EUR Dist,Equity,Emerging Markets,Government Bonds,0.4,,EUR,,,Luxembourg,,,,,,
US97717X7848,EMCB,WisdomTree Emerging Markets Corporate Bond Fund,Bond,Emerging Markets,Corporate Bonds,0.61,99,USD,,,United States,,,,,,
US74347B8476,EMDV,ProShares MSCI Emerging Markets Dividend Growers ETF,Equity,Emerging Markets,Dividend,0.6,7,USD,,,United States,,,,,,
LU1650490474,LYQ1,MULTI-UNITS LUXEMBOURG - Lyxor Euro Government Bond (DR) UCITS ETF - Acc,Bond,Global / Outros,Government Bonds,,,EUR,,,Luxembourg,,,,,,
US46434G8895,EMGF,iShares MSCI Emerging Markets Multifactor ETF,Equity,Emerging Markets,Emerging Markets,0.26,1937,USD,,,United States,,,,,,
US78468R5155,EMHC,SPDR Bloomberg Barclays Emerging Markets USD Bond ETF,Bond,Emerging Markets,Government Bonds,0.23,272,USD,,,United States,,,,,,
US4642862852,EMHY,iShares J.P. Morgan EM High Yield Bond ETF,Bond,Global / Outros,High Yield Bonds,0.5,607,USD,,,United States,,,,,,
US4642882165,EMIF,iShares Emerging Markets Infrastructure ETF,Equity,Emerging Markets,Emerging Markets,0.6,13,USD,,,United States,,,,,,
IE00B7MXFZ59,SYBI,SPDR Bloomberg Barclays EM Inflation Linked Local Bond UCITS ETF,Bond,Global / Outros,Inflation-Protected Securities,0.55,37,EUR,,,Ireland,,,,,,
US92189H3003,EMLC,VanEck Vectors J.P. Morgan EM Local Currency Bond ETF,Bond,Global / Outros,Government Bonds,0.3,4872,USD,,,United States,,,,,,
US33738D1019,EMLP,First Trust North American Energy Infrastructure Fund,Equity,Global / Outros,Energy,0.95,4058,USD,,,United States,,,,,,
US97717Y7821,EMMF,WisdomTree Emerging Markets Multifactor Fund,Equity,Emerging Markets,Emerging Markets,0.48,179,USD,,,United States,,,,,,
LU0705291903,EMMV,Ossiam Emerging Markets Minimum Variance NR UCITS ETF 1C (EUR),Equity,Emerging Markets,Emerging Markets,,,EUR,,,Luxembourg,,,,,,
US72201R6430,EMNT,PIMCO Enhanced Short Maturity Active ESG Exchange-Traded Fund,Bond,Global / Outros,Cash,0.24,212,USD,,,United States,,,,,,
LU1377382012,MOEU,BNP Paribas Easy Equity Momentum Europe UCITS ETF Cap,Equity,Europe,Broad Market,,5,EUR,,,Luxembourg,,,,,,
US3015058890,EMQQ,EMQQ The Emerging Markets Internet & Ecommerce ETF,Equity,Emerging Markets,Emerging Markets,0.86,249,USD,,,United States,,,,,,
IE00B3LK4Z20,EMSV,Invesco MSCI Europe Value UCITS ETF,Equity,Europe,Developed Markets,0.35,9,EUR,,,Ireland,,,,,,
US78470P3091,EMTL,SPDR DoubleLine Emerging Markets Fixed Income ETF,Bond,Emerging Markets,Corporate Bonds,0.65,77,USD,,,United States,,,,,,
US74347B3675,EMTY,ProShares Decline of the Retail Store ETF,Equity,Global / Outros,Trading,0.65,3,USD,,,United States,,,,,,
LU1169820641,EMUUSD,UBS ETF - MSCI EMU UCITS ETF (hedged to USD) A-acc,Equity,Europe,Broad Market,0.22,,USD,,,Luxembourg,,,,,,
US46434G7640,EMXC,iShares MSCI Emerging Markets ex China ETF,Equity,Emerging Markets,Emerging Markets,0.25,26057,USD,,,United States,,,,,,
US46436E7426,EMXF,iShares ESG Advanced MSCI EM ETF,Equity,Global / Outros,Emerging Markets,0.16,161,USD,,,United States,,,,,,
PLENEA000013,ENBA,Enbridge Inc. 6.375 SNT18 B 78,Equity,Global / Outros,Broad Market,,,USD,,,,,,,,,
LU0533032420,LYPC,Lyxor MSCI World Energy TR UCITS ETF - C-EUR,Equity,World / Global,Energy,0.3,,EUR,,,Luxembourg,,,,,,
US00162Q6769,ENFR,Alerian Energy Infrastructure ETF,Equity,Global / Outros,Energy,0.35,468,USD,,,United States,,,,,,
JE00B6XL6W59,ENIK,WisdomTree Nickel - EUR Daily Hedged,Commodity,Global / Outros,Broad Market,,2,EUR,,,Jersey,,,,,,
US46429B4995,ENOR,iShares MSCI Norway ETF,Equity,Global / Outros,Developed Markets,0.53,83,USD,,,United States,,,,,,
US4642891232,ENZL,iShares MSCI New Zealand ETF,Equity,Global / Outros,Developed Markets,0.5,65,USD,,,United States,,,,,,
US46429B4086,EPHE,iShares MSCI Philippines ETF,Equity,Global / Outros,Emerging Markets,0.59,128,USD,,,United States,,,,,,
US97717W4226,EPI,WisdomTree India Earnings Fund,Equity,India,Emerging Markets,0.84,2123,USD,,,United States,,,,,,
US46429B6065,EPOL,iShares MSCI Poland ETF,Equity,Global / Outros,Emerging Markets,0.59,679,USD,,,United States,,,,,,
US4642866655,EPP,iShares MSCI Pacific ex Japan ETF,Equity,Japan,Developed Markets,0.47,2029,USD,,,United States,,,,,,
US45783Y8223,EPRF,Innovator S&P Investment Grade Preferred ETF,Bond,Global / Outros,Investment Grade Bonds,0.47,69,USD,,,United States,,,,,,
US97717W5884,EPS,WisdomTree U.S. Earnings 500 Fund,Equity,North America,Large Cap,0.08,1579,USD,,,United States,,,,,,
US74349Y7206,EPV,ProShares UltraShort FTSE Europe,Equity,Europe,Developed Markets,0.95,13,USD,,,United States,,,,,,
US46138E4200,EQAL,Invesco Russell 1000 Equal Weight ETF,Equity,Global / Outros,Factors,0.2,808,USD,,,United States,,,,,,
IE00BYVTMW98,EQEU,Invesco EQQQ NASDAQ-100 UCITS ETF (EUR Hdg),Equity,North America,Broad Market,0.35,,EUR,,,Ireland,,,,,,
US19761L8542,EQIN,Russell Equity Income ETF,Equity,Global / Outros,Broad Market,0.35,287,USD,,,United States,,,,,,
US00162Q2057,EQL,ALPS Equal Sector Weight ETF,Equity,Global / Outros,Factors,0.19,733,USD,,,United States,,,,,,
US74347B3915,EQRR,ProShares Equities for Rising Rates ETF,Equity,Global / Outros,Factors,0.35,38,USD,,,United States,,,,,,
