isin,ticker,name,ac,region,sector,ter,size,cur,dist,repl,dom,ytd,y1,y3,vol,div,nh
IE000JNKVS10,JPSC,JPMorgan BetaBuilders US Small Cap Equity UCITS ETF USD (acc),Equity,North America,Small/Mid Cap,0.13,72,USD,Accumulating,Full replication,Ireland,25.73,39.21,59.67,16.87,,1279
LU0994505336,XESD,Xtrackers Spanish Equity UCITS ETF 1D,Equity,Global / Outros,Broad Market,0.3,72,EUR,Distributing,Full replication,Luxembourg,14.82,45.46,122.98,16.24,2.34,42
IE00BMDBMT65,ESGP,Invesco MSCI Pacific Ex Japan Universal Screened UCITS ETF Acc,Equity,Japan,Broad Market,0.19,72,USD,Accumulating,Full replication,Ireland,7.45,12.73,31.24,11.84,,86
DE000A2QP331,EXIC,iShares Core DAX® UCITS ETF (DE) EUR (Dist),Equity,Germany,Broad Market,0.16,72,EUR,Distributing,Full replication,Germany,1.81,5.36,52.74,15.75,2.04,40
LU2439874319,C9DF,Frankfurter UCITS ETF Modern Value,Equity,Global / Outros,Factor / Style,0.54,72,EUR,Accumulating,Full replication,Luxembourg,-1.22,0.03,25.61,12.95,,
IE00020O1MD6,CD1,comdirect S&P All World State Street UCITS ETF USD Unhedged (Acc),Equity,World / Global,Broad Market,0.4,72,USD,Accumulating,Optimized sampling,Ireland,,,,,,
IE000Z8J5HD7,CTUT,Amundi S&P 500 Climate Transition UCITS ETF (Acc),Equity,North America,Broad Market,0.09,72,USD,Accumulating,Full replication,Ireland,10.07,,,,,
IE000G8WOLX8,US4E,State Street SPDR S&P 400 U.S. Mid Cap UCITS ETF EUR Hedged (Dist),Equity,North America,Small/Mid Cap,0.35,72,EUR<br />Hedged,Distributing,Full replication,Ireland,16,21.52,,16.29,0.69,400
LU1437025296,ACU5,Amundi MSCI UK IMI SRI Climate Paris Aligned UCITS ETF - GBP (C),Equity,United Kingdom,Broad Market,0.18,72,GBP,Accumulating,Full replication,Luxembourg,6.53,16.38,49.2,14.35,,57
LU2082997516,EHLT,Amundi STOXX Europe 600 Healthcare UCITS ETF Dist,Equity,Europe,Health Care,0.3,71,EUR,Distributing,Swap based Unfunded,Luxembourg,2.93,14.03,15.18,16.11,1.27,
IE00BMTX2B82,AYE7,iShares AEX UCITS ETF EUR (Acc),Equity,Global / Outros,Broad Market,0.3,71,EUR,Accumulating,Full replication,Ireland,14.93,20.72,49.1,13.2,,30
IE00BF2B0P08,FLXU,Franklin U.S. Equity UCITS ETF,Equity,North America,Broad Market,0.2,71,USD,Accumulating,Full replication,Ireland,16.47,29.78,53.8,13.07,,209
IE000OW54ZX1,AVUS,Avantis America Equity UCITS ETF Acc,Equity,Global / Outros,Broad Market,0.2,70,USD,Accumulating,Full replication,Ireland,,,,,,
IE00B27YCF74,IUSB,iShares Global Timber & Forestry UCITS ETF,Equity,World / Global,Materials,0.65,70,USD,Distributing,Full replication,Ireland,-5.22,-6.06,-8.32,16.23,2.85,25
IE000O8S1EX4,T3MP,JPMorgan Climate Change Solutions Active UCITS ETF USD (acc),Equity,Global / Outros,Broad Market,0.55,70,USD,Accumulating,Full replication,Ireland,25.08,34.9,52.8,14.18,,60
IE00BJ5JP212,36BB,iShares MSCI World Consumer Discretionary Sector Advanced UCITS ETF USD (Dist),Equity,World / Global,Consumer,0.18,70,USD,Distributing,Full replication,Ireland,1.81,9.89,22.27,15.81,0.81,117
DE000A0H08S0,EXV9,iShares STOXX Europe 600 Travel & Leisure UCITS ETF (DE),Equity,Europe,Broad Market,0.46,70,EUR,Distributing,Full replication,Germany,4.42,11.42,21.58,20.96,3.59,13
IE000004V778,WGES,Amundi MSCI World SRI Climate Paris Aligned UCITS ETF Dist,Equity,World / Global,Broad Market,0.18,70,USD,Distributing,Full replication,Ireland,19.43,26.84,,12.44,0.96,294
IE00064TWYK9,JEEP,JPMorgan Europe Equity Premium Income Active UCITS ETF EUR (dist),Equity,Europe,Broad Market,0.35,70,EUR,Distributing,Full replication,Ireland,,,,,,154
LU1681043169,10A3,Amundi MSCI India Swap II UCITS ETF USD Acc,Equity,India,Broad Market,0.8,69,USD,Accumulating,Swap based Unfunded,Luxembourg,-7.27,-10.65,8.84,15.62,,
LU1215451524,UIM2,UBS Factor MSCI EMU Quality Screened UCITS ETF EUR dis,Equity,Europe,Factor / Style,0.25,69,EUR,Distributing,Full replication,Luxembourg,7.69,7.13,17.5,13.75,1.51,63
DE000ETFL326,EL46,Deka MSCI China ex A Shares UCITS ETF,Equity,China,Broad Market,0.65,69,HKD,Distributing,Full replication,Germany,-15.98,-6.47,16.24,19.79,1.66,169
IE000TD3TI26,JPVA,JPMorgan US Value Equity Active UCITS ETF USD (acc),Equity,North America,Factor / Style,0.5,69,USD,Accumulating,Full replication,Ireland,15.72,26.88,,11.79,,149
IE00077IIPQ8,NTSG,WisdomTree Global Efficient Core UCITS ETF USD Unhedged Acc,Equity,World / Global,Broad Market,0.25,69,USD,Accumulating,Optimized sampling,Ireland,13.09,24.14,,10.83,,329
DE000ETF9033,E903,Amundi DivDAX II UCITS ETF Dist,Equity,Global / Outros,Broad Market,0.25,69,EUR,Distributing,Full replication,Germany,0.57,9.75,28.43,14.13,3.64,15
LU1834985845,LFOD,Amundi STOXX Europe 600 Consumer Staples UCITS ETF Acc,Equity,Europe,Consumer,0.3,68,EUR,Accumulating,Swap based Unfunded,Luxembourg,4.36,6.23,0.94,13.22,,
IE00002ZKAP0,XEEE,Xtrackers Europe Equity Enhanced Active UCITS ETF 1C,Equity,Europe,Broad Market,0.25,68,EUR,Accumulating,Full replication,Ireland,9.72,20.15,,12.29,,196
IE000O5M6XO1,AAKG,ARK Genomic Revolution UCITS ETF USD Accumulating,Equity,Global / Outros,Health Care,0.75,68,USD,Accumulating,Full replication,Ireland,53.03,85.08,,41.77,,32
IE0001QF56M0,CHIN,KraneShares ICBCCS China S&P 500 UCITS ETF,Equity,China,Broad Market,0.55,67,USD,Accumulating,Full replication,Ireland,8.32,29.36,,16.87,,578
LU3086264317,EDE2,BNP Paribas Easy MSCI Emerging ex China UCITS ETF Acc,Equity,EM ex-China,Broad Market,0.09,67,USD,Accumulating,Swap based Unfunded,Luxembourg,,,,,,
IE00BDF12W49,WTD8,WisdomTree Emerging Markets Equity Income UCITS ETF Acc,Equity,Emerging Markets,Broad Market,0.46,67,USD,Accumulating,Optimized sampling,Ireland,20.48,27.4,57.25,10.39,,396
IE000XOQ9TK4,XNGI,Xtrackers MSCI Next Generation Internet Innovation UCITS ETF 1C,Equity,Global / Outros,Technology,0.3,66,USD,Accumulating,Full replication,Ireland,17.95,29.29,98.47,19.39,,100
IE00B2QWDR12,IUS9,iShares MSCI AC Far East ex-Japan Small Cap UCITS ETF,Equity,Japan,Small/Mid Cap,0.74,66,USD,Distributing,Optimized sampling,Ireland,15.29,39.2,56.14,23.6,1.88,1116
IE00BDZCKK11,QVMP,Invesco S&P 500 QVM UCITS ETF,Equity,North America,Broad Market,0.35,66,USD,Distributing,Full replication,Ireland,24.66,29.66,82.54,12.6,0.77,100
IE000GEHNQU9,WELL,Amundi S&P Global Information Technology ESG UCITS ETF DR EUR (D),Equity,World / Global,Technology,0.18,65,EUR,Distributing,Full replication,Ireland,18.99,37.11,96.95,20.7,0.27,107
IE000WX7BVB0,JEGA,JPMorgan Global Equity Premium Income Active UCITS ETF USD (acc),Equity,World / Global,Broad Market,0.35,65,USD,Accumulating,Full replication,Ireland,2.35,5.38,,7.83,,236
LU3086269894,EDEY,BNP Paribas Easy MSCI Japan UCITS ETF Acc,Equity,Japan,Broad Market,0.06,65,EUR,Accumulating,Full replication,Luxembourg,20.55,,,,,
IE000H7PE775,MWHE,Amundi Core MSCI World UCITS ETF EUR Hedged Acc,Equity,World / Global,Broad Market,0.14,65,EUR<br />Hedged,Accumulating,Full replication,Ireland,9.91,,,,,1299
IE00BL977C92,IS4T,iShares MSCI China UCITS ETF USD (Dist),Equity,China,Broad Market,0.28,65,USD,Distributing,Full replication,Ireland,-12.31,-2.43,18.55,18.11,2.3,582
IE00B94ZB998,SMLP,Invesco Morningstar US Energy Infrastructure MLP UCITS ETF Acc,Equity,North America,Energy,0.5,65,USD,Accumulating,Swap based Unfunded,Ireland,18.46,16.47,52.9,15.17,,
LU1377381717,VLEU,BNP Paribas Easy Low Volatility Europe UCITS ETF,Equity,Europe,Broad Market,0.31,65,EUR,Accumulating,Swap based Unfunded,Luxembourg,9.08,13.87,38.9,11.2,,
IE000C6ITGC8,QOMP,iShares Quantum Computing UCITS ETF USD (Acc),Equity,Global / Outros,Broad Market,0.5,65,USD,Accumulating,Full replication,Ireland,31.4,,,,,30
IE000WDG5795,QP70,iShares Lithium & Battery Producers UCITS ETF USD (Acc),Equity,Global / Outros,Broad Market,0.55,65,USD,Accumulating,Full replication,Ireland,33.4,108.41,,28.99,,64
IE00BMZ17X30,AYET,iShares MSCI World SRI UCITS ETF USD Hedged (Dist),Equity,World / Global,Broad Market,0.23,64,USD<br />Hedged,Distributing,Full replication,Ireland,17.9,26.86,50.47,11.72,1.12,374
IE00B5B5TG76,S6X0,Invesco EURO STOXX 50 UCITS ETF Dist,Equity,Europe,Broad Market,0.05,64,EUR,Distributing,Swap based Unfunded,Ireland,10.85,22.1,55.05,15.54,2.75,
IE00BMH5Y871,BUG,Global X Cybersecurity UCITS ETF USD Accumulating,Equity,World / Global,Cybersecurity,0.5,64,USD,Accumulating,Full replication,Ireland,34,12.65,55.81,31.27,,29
IE00BKPTXQ89,JMLP,HANetf Alerian Midstream Energy Dividend UCITS ETF Dist,Equity,Global / Outros,Energy,0.49,64,USD,Distributing,Full replication,Ireland,28.97,32.38,83.32,23.87,3.74,18
IE00042EX8S2,3DGD,Robeco 3D Global Equity UCITS ETF USD Dis,Equity,World / Global,Broad Market,0.25,64,USD,Distributing,Full replication,Ireland,,,,,,
LU1659681669,EKUS,BNP Paribas Easy MSCI USA SRI S-Series PAB 5% Capped UCITS ETF EUR Dis,Equity,North America,Broad Market,0.25,63,EUR,Distributing,Full replication,Luxembourg,12.46,13.33,29.68,13.39,1.05,108
IE00050J4789,ESAG,BNP Paribas Easy MSCI USA Small Cap Min TE UCITS ETF EUR Acc,Equity,North America,Small/Mid Cap,0.25,63,EUR,Accumulating,Full replication,Ireland,26.84,41.54,,17.01,,1374
LU0328474803,DX2S,Xtrackers S&P/ASX 200 UCITS ETF 1D,Equity,Global / Outros,Broad Market,0.5,62,AUD,Distributing,Full replication,Luxembourg,8,13.88,31.09,14.36,2.55,202
LU2873560481,CEUH,Amundi MSCI Europe ESG Broad Transition UCITS ETF EUR Hedged Acc,Equity,Europe,Broad Market,0.14,62,EUR<br />Hedged,Accumulating,Full replication,Luxembourg,10.03,21.36,,12.19,,379
IE000XIBT2R7,LVLE,Invesco Global Active Defensive ESG Equity UCITS ETF EUR PfHdg Acc,Equity,World / Global,Broad Market,0.3,62,EUR<br />Hedged,Accumulating,Full replication,Ireland,4.78,11.13,46.65,9.21,,366
IE00BYV1YF22,FEUG,Fidelity Global Quality Income UCITS ETF INC-GBP (hedged),Equity,World / Global,Factor / Style,0.45,61,GBP<br />Hedged,Distributing,Full replication,Ireland,13.55,24.91,59.25,11.51,1.76,242
IE00BYX5K108,MXUK,Invesco MSCI Europe ex-UK UCITS ETF,Equity,United Kingdom,Broad Market,0.2,61,EUR,Accumulating,Swap based Unfunded,Ireland,11.45,21.5,49,12.8,,
IE000WQ5O293,ESAC,BNP Paribas Easy MSCI ACWI SRI S-Series PAB 5% Capped UCITS ETF USD C,Equity,World / Global,Broad Market,0.22,61,USD,Accumulating,Full replication,Ireland,14.51,19.75,,10.22,,1673
IE0000902GT6,WMGT,WisdomTree Megatrends UCITS ETF USD,Equity,Global / Outros,Broad Market,0.5,61,USD,Accumulating,Full replication,Ireland,23.21,45.43,,19.27,,696
IE00B8KMSQ34,XDPC,Xtrackers S&P 500 UCITS ETF 3C CHF hedged,Equity,North America,Broad Market,0.05,61,CHF<br />Hedged,Accumulating,Full replication,Ireland,8.89,18.03,60.54,13.5,,504
LU3086273813,EDEM,BNP Paribas Easy MSCI Emerging UCITS ETF Acc,Equity,Emerging Markets,Broad Market,0.09,61,USD,Accumulating,Swap based Unfunded,Luxembourg,,,,,,
LU2206597804,UIW1,UBS MSCI Europe Socially Responsible UCITS ETF EUR acc,Equity,Europe,Broad Market,0.18,61,EUR,Accumulating,Full replication,Luxembourg,8.13,12.25,35.04,12.63,,131
DE000ETFL292,EL43,Deka MSCI Europe MC UCITS ETF,Equity,Europe,Broad Market,0.36,61,EUR,Distributing,Full replication,Germany,10.49,19.73,57.03,11.03,2.41,223
IE00BF0M6N54,ETLH,L&G Ecommerce Logistics UCITS ETF,Equity,Global / Outros,Broad Market,0.49,61,USD,Accumulating,Full replication,Ireland,0.37,4.95,14.58,12.21,,48
DE000A2QP4F7,T05A,iShares STOXX Global Select Dividend 100 UCITS ETF (DE) EUR Hedged (Acc),Equity,World / Global,Dividend,0.48,60,EUR<br />Hedged,Accumulating,Full replication,Germany,,,,,,100
IE00BDR5H412,AW1A,UBS Global Gender Equality UCITS ETF hCHF acc,Equity,World / Global,Factor / Style,0.23,60,CHF<br />Hedged,Accumulating,Full replication,Ireland,4.5,12.76,40.76,10.48,,99
DE000ETFL045,EL4D,Deka STOXX Europe Strong Value 20 UCITS ETF,Equity,Europe,Factor / Style,0.65,60,EUR,Distributing,Full replication,Germany,3.75,19.61,79.31,16.84,1.37,20
IE000BO2Y0T8,XMN1,Xtrackers MSCI Nordic UCITS ETF 1C,Equity,Global / Outros,Broad Market,0.3,59,EUR,Accumulating,Full replication,Ireland,7.77,14.22,,14.83,,83
LU3086265710,EDEL,BNP Paribas Easy MSCI ACWI UCITS ETF (Acc),Equity,World / Global,Broad Market,0.06,59,USD,Accumulating,Swap based Unfunded,Luxembourg,14.94,,,,,
IE000HARJEE2,CEB4,iShares Core FTSE 100 UCITS ETF EUR Hedged (Acc),Equity,United Kingdom,Broad Market,0.1,59,EUR<br />Hedged,Accumulating,Full replication,Ireland,6.56,20.82,,11.46,,102
LU0832435464,VOOL,Amundi S&P 500 VIX Futures Enhanced Roll UCITS ETF Acc,Equity,North America,Broad Market,0.6,59,USD,Accumulating,Swap based Unfunded,Luxembourg,-4.17,-19.77,-58.68,29.67,,
IE000JLILKH0,JRWU,JPMorgan All Country Research Enhanced Index Equity Active UCITS ETF USD (dist),Equity,World / Global,Broad Market,0.25,59,USD,Distributing,Full replication,Ireland,14.53,27.58,,10.1,0.8,981
IE00B3Y8D011,XS7W,Xtrackers Portfolio Income UCITS ETF 1D,Equity,Global / Outros,Broad Market,0.65,59,EUR,Distributing,Full replication,Ireland,5.1,9.15,22.9,3.78,2.86,9903
IE000VDI16Q5,MEWD,Invesco MSCI Europe Equal Weight UCITS ETF Dist,Equity,Europe,Factor / Style,0.2,58,EUR,Distributing,Full replication,Ireland,9,17.45,,11.17,2.69,399
LU2993402101,EDEJ,BNP Paribas Easy Alpha Enhanced Europe UCITS ETF Acc,Equity,Europe,Broad Market,0.13,58,EUR,Accumulating,Full replication,Luxembourg,11.9,,,,,
IE00B60SWY32,SC0E,Invesco MSCI Europe UCITS ETF,Equity,Europe,Broad Market,0.19,58,EUR,Accumulating,Swap based Unfunded,Ireland,10.59,21.85,49.77,12.2,,
IE000XYBMEH0,HSMD,HSBC Emerging Market Screened Equity UCITS ETF USD (Dist),Equity,Emerging Markets,Broad Market,0.18,58,USD,Distributing,Full replication,Ireland,14.92,31.79,60.32,14.45,2.02,657
IE00023EZQ82,CBUN,iShares Digital Entertainment and Education UCITS ETF USD (Acc),Equity,Global / Outros,Technology,0.4,58,USD,Accumulating,Full replication,Ireland,29.86,31.51,119.33,18.78,,84
IE00BYTRR640,SS41,State Street SPDR MSCI World Consumer Discretionary UCITS ETF USD,Equity,World / Global,Consumer,0.3,58,USD,Accumulating,Full replication,Ireland,1.36,10.89,28.97,15.85,,120
LU1940199984,BUN5,Amundi MSCI Europe ESG Selection UCITS ETF EUR Hedged Acc,Equity,Europe,Broad Market,0.25,57,EUR<br />Hedged,Accumulating,Full replication,Luxembourg,13.39,23.25,42.72,12.58,,209
IE000MMRLY96,YYYY,YieldMax Big Tech Option Income UCITS ETF Dist,Equity,Global / Outros,Technology,0.99,57,USD,Distributing,Full replication,Ireland,0.21,5,,18.85,27.27,
IE00BYTH6121,FTG4,First Trust Global Equity Income UCITS ETF Acc,Equity,World / Global,Broad Market,0.6,57,USD,Accumulating,Full replication,Ireland,12.62,29.95,67.51,8.57,,293
LU2240851688,DECD,Amundi MSCI EMU Screened UCITS ETF Acc,Equity,Europe,Broad Market,0.12,57,EUR,Accumulating,Full replication,Luxembourg,9.47,14.27,58.32,14.77,,50
IE0000ZL1RD2,C8PX,Global X AI Semiconductor & Quantum UCITS ETF USD Acc,Equity,World / Global,Semiconductors,0.35,57,USD,Accumulating,Full replication,Ireland,100.94,,,,,36
LU1681048127,B500,Amundi S&P 500 Buyback UCITS ETF EUR (C),Equity,North America,Factor / Style,0.15,57,EUR,Accumulating,Swap based Unfunded,Luxembourg,12.37,20.23,51.29,13.22,,
LU3086271106,EDEP,BNP Paribas Easy MSCI World II UCITS ETF Acc,Equity,World / Global,Broad Market,0.08,57,USD,Accumulating,Swap based Unfunded,Luxembourg,,,,,,
IE000WHL2ZK1,INCU,iShares U.S. Equity High Income Active UCITS ETF USD (Dist),Equity,North America,Broad Market,0.35,57,USD,Distributing,Full replication,Ireland,13.4,25.93,,10.74,8.37,289
IE00082MOBL9,EVSD,Global X European SuperDividend UCITS ETF EUR Dist,Equity,World / Global,Dividend,0.45,56,EUR,Distributing,Full replication,Ireland,16.3,,,,,25
IE000AXUR1L9,USIQ,AI-Enhanced US Equities UCITS ETF (Dist),Equity,North America,AI & Big Data,0.65,56,USD,Distributing,Full replication,Ireland,13.96,27.2,,12.63,0,
IE00BGJWX091,XDPD,Xtrackers S&P 500 UCITS ETF 1D - EUR Hedged,Equity,North America,Broad Market,0.05,56,EUR<br />Hedged,Distributing,Full replication,Ireland,9.03,19.68,62.4,13.09,0.71,504
LU1574142243,STXH,Amundi Core Stoxx Europe 600 UCITS ETF EUR Hedged Dist,Equity,Europe,Broad Market,0.15,56,EUR<br />Hedged,Distributing,Full replication,Luxembourg,9.81,21.28,48.87,11.78,2.35,610
LU1681038912,JP40,Amundi JPX Nikkei 400 UCITS ETF EUR (C),Equity,Japan,Broad Market,0.18,56,EUR,Accumulating,Swap based Unfunded,Luxembourg,20.17,33.01,59.36,18.61,,
LU1681046006,WDNR,Amundi Global Bioenergy UCITS ETF EUR Acc,Equity,World / Global,Energy,0.35,56,EUR,Accumulating,Full replication,Luxembourg,30,42.18,25.43,15.62,,25
IE000Q6C8036,ESAA,BNP Paribas Easy S&P 500 Scored and Screened UCITS ETF EUR Hedged Acc,Equity,North America,Broad Market,0.13,56,EUR<br />Hedged,Accumulating,Full replication,Ireland,9.44,23.06,,12.86,,330
IE0006VDD4K1,FWEA,Invesco FTSE All-World UCITS ETF EUR PfHdg Acc,Equity,World / Global,Broad Market,0.2,56,EUR<br />Hedged,Accumulating,Sampling,Ireland,11.53,23.96,63.9,10.96,,2353
IE000RLUE8E9,PAUS,Invesco MSCI USA ESG Climate Paris Aligned UCITS ETF Acc,Equity,North America,Broad Market,0.09,55,USD,Accumulating,Full replication,Ireland,12.01,16.09,47.8,15.06,,81
IE00BLRPQH31,RIZF,Rize Sustainable Future of Food UCITS ETF,Equity,Global / Outros,Broad Market,0.45,55,USD,Accumulating,Full replication,Ireland,9.58,0.88,-11.6,14.14,,52
IE000W85O7M4,JUIE,JPMorgan US Research Enhanced Index Equity Active UCITS ETF EUR (acc),Equity,North America,Broad Market,0.2,55,EUR,Accumulating,Full replication,Ireland,13.04,25.75,,12.1,,251
IE00BZ0G8C04,ZPDW,State Street SPDR MSCI Japan UCITS ETF EUR Hedged,Equity,Japan,Broad Market,0.17,55,EUR<br />Hedged,Accumulating,Optimized sampling,Ireland,21.84,49.96,100.68,20.77,,168
IE000VKFA2D2,XDJX,Xtrackers DJE Europe Equity Research UCITS ETF 1C,Equity,Europe,Broad Market,0.5,55,EUR,Accumulating,Full replication,Ireland,10.59,,,,,50
IE00BFM15T99,36B2,iShares Core MSCI Japan IMI UCITS ETF USD (Dist),Equity,Japan,Broad Market,0.12,55,USD,Distributing,Optimized sampling,Ireland,19.33,32.56,58.95,19.3,1.57,960
IE000ZYE17Z0,27U0,iShares World Equity Enhanced Active UCITS ETF GBP Hedged (Acc),Equity,World / Global,Broad Market,0.3,54,GBP<br />Hedged,Accumulating,Full replication,Ireland,13.48,25.3,,12.56,,623
IE000R65LK54,UQE2,UniActive Q Equities Global Enhanced UCITS ETF EUR (Acc),Equity,World / Global,Broad Market,0.25,54,EUR,Accumulating,Full replication,Ireland,13.31,,,,,
IE00BN4Q0370,AW10,UBS MSCI World ex USA Climate Paris Aligned UCITS ETF USD acc,Equity,World ex-US,Broad Market,0.12,54,USD,Accumulating,Full replication,Ireland,11.07,22.08,61.35,11.65,,420
IE00BMYDMC42,LGGM,L&G Emerging Markets Quality Dividends Equal Weight UCITS ETF USD Dist,Equity,Emerging Markets,Dividend,0.45,54,USD,Distributing,Optimized sampling,Ireland,15.16,28.88,58.83,10.45,2.31,569
IE00BMDBMY19,ESGM,Invesco MSCI Emerging Markets Universal Screened UCITS ETF Acc,Equity,Emerging Markets,Broad Market,0.19,54,USD,Accumulating,Full replication,Ireland,29.75,49.73,74.91,18.5,,471
IE00BMH5VP31,3I40,iShares Edge MSCI World Minimum Volatility Advanced UCITS ETF EUR Hedged (Acc),Equity,World / Global,Factor / Style,0.35,54,EUR<br />Hedged,Accumulating,Optimized sampling,Ireland,0.87,1.76,24.37,8.26,,247
IE00BDZVHG35,OM3E,iShares Nasdaq US Biotechnology UCITS ETF USD (Dist),Equity,North America,Technology,0.35,53,USD,Distributing,Optimized sampling,Ireland,19.07,60.57,55.52,19.68,0.23,253
IE00BKWQ0N82,SPYT,State Street SPDR MSCI Europe Communication Services UCITS ETF EUR,Equity,Europe,Communication,0.18,53,EUR,Accumulating,Full replication,Ireland,-2.67,-11.67,26.52,13.07,,21
DE000ETFL276,EL41,Deka MSCI USA MC UCITS ETF,Equity,North America,Broad Market,0.3,53,USD,Distributing,Full replication,Germany,14.7,20.42,42.04,13.4,1.47,304
IE000CFH1JX2,6II0,iShares Global Water UCITS ETF USD (Acc),Equity,World / Global,Water,0.65,52,USD,Accumulating,Full replication,Ireland,6.71,8.94,26,11.85,,68
LU3243907741,EEAB,BNP Paribas Easy MSCI ACWI UCITS ETF EUR (Acc),Equity,World / Global,Broad Market,0.06,51,EUR,Accumulating,Swap based Unfunded,Luxembourg,,,,,,
LU0292105359,DXSK,Xtrackers MSCI Europe Consumer Staples UCITS ETF 1C,Equity,Europe,Consumer,0.17,51,EUR,Accumulating,Full replication,Luxembourg,4.79,1.13,-9.83,15.37,,38
LU1215452928,UIMZ,UBS Factor MSCI EMU Prime Value Screened UCITS ETF EUR dis,Equity,Europe,Factor / Style,0.25,51,EUR,Distributing,Full replication,Luxembourg,18.14,27.73,54.05,11.53,2.43,64
LU2402389261,APXJ,Amundi MSCI Pacific Ex Japan SRI Climate Paris Aligned UCITS ETF DR - EUR (D),Equity,Japan,Broad Market,0.45,51,EUR,Distributing,Full replication,Luxembourg,4.44,3.44,11.14,12.73,2.76,37
IE00BQZJBQ63,WTEU,WisdomTree US Equity Income UCITS ETF,Equity,North America,Broad Market,0.29,51,USD,Distributing,Full replication,Ireland,15.46,25.78,47.62,11.99,2.52,285
LU1615090864,EDEU,BNP Paribas Easy Dividend Europe UCITS ETF,Equity,Europe,Dividend,0.31,51,EUR,Accumulating,Swap based Unfunded,Luxembourg,12.05,24.01,75.7,10.91,,
IE00BNTVVR89,ZSG0,HANetf Gold Miners Screened UCITS ETF (Acc),Equity,Global / Outros,Mining,0.6,50,USD,Accumulating,Full replication,Ireland,-6.52,46.14,136.92,41.41,,32
IE000DUSV4J5,UQM1,UniActive Q Equities Emerging Markets Enhanced UCITS ETF USD (Acc),Equity,Emerging Markets,Broad Market,0.3,50,USD,Accumulating,Full replication,Ireland,,,,,,
IE000Z7P04F4,HX60,iShares Nasdaq 100 Top 30 UCITS ETF USD (Acc),Equity,North America,Broad Market,0.3,50,USD,Accumulating,Full replication,Ireland,23.03,42.69,,19.09,,31
LU1291108642,EWRD,BNP Paribas Easy MSCI World SRI S-Series PAB 5% Capped UCITS ETF USD Acc,Equity,World / Global,Broad Market,0.25,50,USD,Accumulating,Full replication,Luxembourg,12.65,16.78,34.49,10.81,,288
IE00075IVKF9,U8NJ,HANetf Sprott Junior Uranium Miners UCITS ETF USD Accumulating,Equity,Global / Outros,Uranium & Nuclear,0.85,50,USD,Accumulating,Full replication,Ireland,-2.13,28.27,,48,,33
DE000ETF7037,F703,Amundi Multi-Asset Portfolio Offensive UCITS ETF Dist,Equity,Global / Outros,Broad Market,0.49,50,EUR,Distributing,Full replication,Germany,15.7,26.24,54.03,12,1.37,1452
IE0008T6IUX0,V3PL,Vanguard ESG Developed Asia Pacific All Cap UCITS ETF (USD) Distributing,Equity,Asia-Pacific,Broad Market,0.17,50,USD,Distributing,Full replication,Ireland,33.93,52.54,74.86,21.34,1.69,1973
IE0002HWPU75,JURY,Jury Global High Dividend UCITS ETF Dist,Equity,World / Global,Dividend,0.6,49,USD,Distributing,Full replication,Ireland,,,,,,90
IE00B5MTXJ97,SC0Y,Invesco European Insurance Sector UCITS ETF Acc,Equity,Global / Outros,Financials,0.2,49,EUR,Accumulating,Swap based Unfunded,Ireland,6.11,15.16,80.12,14.25,,
LU0514694370,XCS3,Xtrackers MSCI Malaysia UCITS ETF 1C,Equity,Global / Outros,Broad Market,0.5,49,USD,Accumulating,Full replication,Luxembourg,2.52,17.86,42.97,10.8,,21
FR0010435297,LNY4,Amundi MSCI Emerging Markets Swap II UCITS ETF USD Acc,Equity,Emerging Markets,Broad Market,0.55,49,USD,Accumulating,Swap based Unfunded,France,27.09,46.94,74.93,18.27,,
IE0002RPS3K2,HYCN,Global X Hydrogen UCITS ETF USD Accumulating,Equity,World / Global,Clean Energy,0.5,49,USD,Accumulating,Full replication,Ireland,76.14,152.13,27.07,48.83,,20
IE00BJ5JP766,CEBN,iShares MSCI World Materials Sector Advanced UCITS ETF USD (Dist),Equity,World / Global,Materials,0.18,49,USD,Distributing,Full replication,Ireland,11.97,24.56,30.6,15.91,1.58,91
IE00BDBRT036,QCLN,First Trust Nasdaq Clean Edge Green Energy UCITS ETF Acc,Equity,North America,Energy,0.6,48,USD,Accumulating,Full replication,Ireland,42.25,94.38,14.08,39.76,,49
IE00B979GK47,SPPD,State Street SPDR S&P U.S. Dividend Aristocrats UCITS ETF EUR Hedged (Dist),Equity,North America,Dividend,0.4,48,EUR<br />Hedged,Distributing,Full replication,Ireland,10.25,11.15,24.21,11.56,2,155
IE00BMYDMB35,LGGA,L&G APAC ex-Japan Quality Dividends Equal Weight UCITS ETF USD Dist,Equity,Japan,Dividend,0.4,48,USD,Distributing,Optimized sampling,Ireland,12.85,25.84,59.37,15.83,2.44,112
IE000QVCOG22,OTUS,Lloyd International Equity UCITS ETF Accumulating,Equity,Global / Outros,Broad Market,0.85,47,EUR,Accumulating,Full replication,Ireland,,,,,,67
IE000W080FK3,H41F,HSBC MSCI Emerging Markets Small Cap Screened UCITS ETF USD (Acc),Equity,Emerging Markets,Small/Mid Cap,0.35,47,USD,Accumulating,Full replication,Ireland,19.75,32.83,53.73,16.81,,917
DE000ETFL607,D6RD,Deka Future Energy ESG UCITS ETF,Equity,Global / Outros,Energy,0.55,47,EUR,Distributing,Full replication,Germany,39.14,86.41,30.67,25.7,0.22,60
LU2059756598,ACU7,Amundi MSCI Europe SRI Climate Paris Aligned UCITS ETF DR (D),Equity,Europe,Broad Market,0.18,46,EUR,Distributing,Full replication,Luxembourg,8.89,9.38,26.96,13.15,1.92,115
IE00BQZJC527,WTES,WisdomTree Europe SmallCap Dividend UCITS ETF,Equity,Europe,Dividend,0.38,46,EUR,Distributing,Full replication,Ireland,6.2,11.02,40.81,11.93,4,276
IE00BLLZQS08,MODR,iShares Moderate Portfolio UCITS ETF EUR (Acc),Equity,Global / Outros,Broad Market,0.25,46,EUR,Accumulating,Full replication,Ireland,6.7,13.41,30.98,5.96,,13691
IE00BMD8KP97,EQQJ,Invesco Nasdaq Next Generation 100 UCITS ETF Acc,Equity,North America,Broad Market,0.25,45,USD,Accumulating,Full replication,Ireland,28.25,48.77,69.73,18.24,,102
LU3078637314,0EMU,Ossiam MSCI EMU UCITS ETF 1C,Equity,Europe,Broad Market,0.12,45,EUR,Accumulating,Swap based,Luxembourg,11.71,,,,,
IE00BF5DXP42,BLOK,First Trust Indxx Innovative Transaction & Process UCITS ETF Acc,Equity,Global / Outros,Broad Market,0.65,44,USD,Accumulating,Full replication,Ireland,12.29,26.53,70.51,11.31,,100
IE0000GXRR13,EUPD,Ossiam Shiller Barclays CAPE® US Sector Screened UCITS ETF 1A/A (EUR),Equity,North America,Broad Market,0.75,44,EUR,Accumulating,Full replication,Ireland,5.3,9.17,,11.02,,128
LU1377382285,VALU,BNP Paribas Easy Value Europe UCITS ETF,Equity,Europe,Factor / Style,0.31,44,EUR,Accumulating,Swap based Unfunded,Luxembourg,12.3,21.99,61.18,11.3,,
IE000AXIKJM8,AIUT,BNP Paribas Easy II MSCI USA PAB UCITS ETF USD Acc,Equity,North America,Broad Market,0.13,44,USD,Accumulating,Full replication,Ireland,10.62,22.9,,13.86,,144
IE000PPEL1I4,LNXB,Investlinx Balanced Income UCITS ETF ETF A EUR Capitalisation,Equity,Global / Outros,Broad Market,0.85,44,EUR,Accumulating,Full replication,Ireland,-0.49,2.34,17.92,8.12,,53
